timestamp,post
48m,"To do userful work, AI agents typically need access to CRMs, ERPs, databases, messaging tools, and more. But as more agents and tools enter the ecosystem, integration becomes increasingly complex.

Model Context Protocol (MCP) acts like a USB-C port for AI agents, serving as a universal connector that simplifies how LLMs link to tools and data.

Discover how MCP not only accelerates agent development but also enables smarter, more effective agents:"
15h,"When a CEO is physically and mentally exhausted, the entire company feels it. “If you don't have the mental space, the clarity, the conviction, and the energy to do the job, you are hamstringing the enterprise,” says BCG’s Christine Barton.

But there are actions CEOs can take to spot the signs of burnout and build greater physical and mental resilience. Read more here:"
1d,"What does it really take to deploy enterprise-ready AI agents?

They’re not plug and play. You need clear processes, quality data, API access, and a workforce ready to engage. Without those, agents can’t deliver value.

In thisseries, BCG’sexplores how AI agents are driving transformative change."
1d,"For consumer products companies, AI is not optional. It’s already everywhere around them.

To compete, they must embed AI at their core, becoming faster, leaner, and more innovative. Since they can’t be rebuilt from scratch, the shift to AI-first must be gradual, starting with optimizing workflows and eventually building new AI-driven businesses.

To learn how your organization can begin this journey, explore our full report here:"
1d,"Although tariff policies dominated Q2 earnings calls, a related concern is also weighing on CEOs’ minds: that trade disruptions may lead to an economic downturn.

That’s the key finding of the third edition of the CEO Radar, an AI-powered analysis from BCG andStudios.

Halfway through 2025, the view is decidedly cloudy from both CEOs and analysts. According to BCG's Global Chair, ""I do think that CEOs are more anxious about the economy...The level of economic uncertainty is higher.""

Read the full analysis here:"
2d,"India’s steel industry is on track to triple by 2050. And the country’s largest steel producer, JSW Steel plays a pivotal role in making sure that growth is green.

In partnership with BCG, JSW launched SEED (Sustainable, Energy, Environment and Decarbonization) in 2022, an initiative focused on decarbonizing operations.

Discover how BCG and JSW are reshaping the future of the steel industry:"
4d,"From Milan to Lisbon, Alessia Soffientini’s BCG journey is one of growth, leadership, and impact.

As a Team Manager at the Lisbon Capability Center (LCC), a fast-growing hub supporting BCG’s global operations, she is shaping culture, mentoring new colleagues, and helping build a strong team from the ground up.

Read the full blog post to see what makes the LCC a place full of opportunity, collaboration, and connection:"
6d,"How are BCG and ServiceNow helping organizations scale digital transformation more effectively?

ServiceNow’sjoined BCG’sandto unpack common challenges in transformation efforts, including misalignment between business priorities and tech investments and underinvestment in change management."
6d,"Mark helps global companies personalize at scale. 

Step 1? Understand people. 

At BCG,has guided the firm’s work in personalization and responsible AI, helping clients use data to create experiences that feel human, not just automated.

His career reflects what thoughtful leadership looks like in practice, especially in moments of change.

Learn how Mark’s perspective helps to shape how organizations grow, adapt, and connect:"
1w,"Where is opportunity knocking for companies looking to embrace cost discipline?

Roland Rott, CEO of GE HealthCare, reflects on a pivotal moment across industries as they embrace technologies like AI."
1w,"Global tariff dynamics are shifting, and companies are responding by building out their strategic capabilities.

In a recentarticle, BCGsexplains how businesses are modeling exposure, adjusting pricing, and using competitor positioning to navigate this new landscape. Cross-functional “Tariff Command Centers” are also emerging, with trade compliance moving from the back office to a core strategic role.

Check out the full article here:"
1w,"Top retailers aren’t just outperforming. They are redefining retail itself.
 
BCG’s latest analysis reveals how traditional players are evolving into data-driven platforms, monetizing traffic, launching B2B digital services, and generating high-margin growth through new revenue streams.

When done right, this creates a powerful new business flywheel effect – and retailers of all sizes can benefit.

Learn more:"
1w,"Just one year since opening its doors, BCG’s Lisbon Capability Center (LCC) is already home to 100+ team members — and growing. 

From HR and Finance to Talent Acquisition and Admin Support, the LCC is a vibrant hub with real opportunities to build a meaningful career and shape the future of our global operations.

Hear from the people making it happen, and explore how you could be part of what’s next:"
1w,"The world may run short of critical raw materials by 2030.

For the energy transition, this presents a challenge. Research from Boston Consulting Group (BCG)andfound that roughly 40% of the materials needed for the energy transition are facing shortages.

Securing and scaling production of materials are critical to its success, but companies must go beyond procurement. That means understanding interconnected supply chains, diversifying sources, investing in innovation, collaborating across industries, and advocating for enabling policy.

Learn more:"
1w,"AI takes trends and market research and turns into business intelligence. Jessica Apotheker, Chief Marketing Officer at Boston Consulting Group (BCG) joins The Executive Table, to discuss how to infuse AI data into your organization to understand where you have a chance to win and act quickly.

Watch Jessica’s episode and explore more candid conversations on The Executive Table, Bloomberg Media Studios’ new video series spotlighting the leaders redefining the future of business:"
1w,"GLP-1 medications have created a $60–90B pharma market by driving weight loss, reducing A1C levels, and delivering cardiac benefits. 

But their ripple effects on medical devices and technology (MedTech) are complex. Insights from 550+ physicians suggest that some sectors may feel pressure from slowing disease progression, but others (such as bariatric surgery, knee operations, or the treatment of heart disease) may benefit from increased awareness, earlier diagnosis, and expanded eligibility.

Read and download the full report:"
1w,"How do you bring GenAI into your daily workflow?

For Alexander Achba, consultant and BCG GenAI Innovation Award winner, it starts with planning smarter, collaborating better, and creating tools that teams across the firm use every day.

From mentoring colleagues to unlocking new ways of working, Alex shows how AI can accelerate growth and drive meaningful impact."
1w,
1w,Stay informed on the latest tariff insights with a recent article by BCG's Marc Gilbert and his colleagues.
1w,"Complex environments don't halt deals; they inspire innovative approaches.

BCG's Russell Kellner shares valuable insights with PitchBook on how private equity firms are skillfully navigating the impact of tariffs.

Momentum is picking up in the second half of the year, particularly in industrial goods, with companies producing tangible assets like tools, safety gear, and building materials leading the way.

Read the full article here:"
1w,"AI is transforming the way marketing is done. While it brings many exciting opportunities, it also comes with common misconceptions.

ofEnterprises and BCG’shighlight the importance of investing in the right technology and combining it with human expertise to design great customer experiences, craft delightful journeys, and drive real impact."
1w,"How are BCG and Microsoft coming together to reimagine today’s enterprises with AI?

Microsoft'sjoined BCG’sandto break down how combining Microsoft’s first-party products with BCG’s functional and industry expertise is unlocking greater value from businesses’ AI investments."
1w,"AI is reshaping the global tech landscape, opening opportunities for new players.

BCG's Nikolaus S. Lang spoke with Bloomberg Television about how AI ""middle powers"" in Europe and the Middle East are emerging, and why companies must think globally to stay competitive.

Watch the conversation."
2w,"Explore a career in Data at BCG with our new and newly enhanced OneDay@BCG job simulations.

Our new Introduction to Data for Decision Makers module is perfect for beginners, offering a chance to analyze marketing data and practice turning insights into strategic recommendations.

Want to go deeper? Our Data Science module is newly enhanced with smarter datasets, sharper visuals, and a more immersive look at how BCG teams solve complex challenges.

These free virtual modules offer a firsthand look at life in Data at BCG.

Enroll now:"
2w,"The future of leisure travel is being reshaped, not only by where people go but by why and how they travel.

Relaxation remains important, but how people unwind is changing. Cultural exploration, wellness retreats, and spiritual or religious journeys are gaining ground. Solo travel is no longer niche. And AI is transforming how people plan and book.

Explore the findings from BCG’s survey of 5,000 people across 11 countries:"
2w,"Policy shifts could reshape the AI map – but talent, not tariffs, will have the greatest long-term impact. 

While many CEOs are understandably focused on trade policy and the rising cost of data center expansion in the US, changes in immigration policies and public funding for R&D may have a more significant effect on the global AIa new report, theexplore a pressing question that should be on the mind of every leader: where will tomorrow’s AI geniuses go?

Even modest increases in the inflow of AI talent could dramatically accelerate the R&D momentum of the GenAI “middle powers”—nations and regional blocs actively positioning themselves to compete alongside the US and China."
2w,"From wiring to wind turbines, copper is critical to many industries. It is also in short supply.

Read more to understand the impact of the proposed 50% US tariff on copper imports."
2w,"Google. IBM. Samsung. Amazon. Apple. Microsoft. 

These are the “serial innovators” who appeared the most frequently in BCG’s Most Innovative Companies report over the past two decades.

During that time, 178 unique companies earned a spot in the rankings. But just 25 companies appeared ten or more times.

Uncover the patterns behind innovation excellence:"
2w,"Tariffs are becoming an increasingly important factor in shaping MedTech strategy, with BCG analysis suggesting that 10% to 40% of EBIT margin could be impacted. Yet many companies are still in the early stages of building the right capabilities to adapt.

Our latest article explores how MedTech leaders can stay ahead by advancing supply chain visibility, enabling data-driven compliance, and applying design-to-tariff thinking across the value chain.

Read the full report:"
2w,"How can companies deliver real value to customers quickly, and help them scale with confidence?

’sshared his perspective in a recent conversation with BCG’sand"
2w,"From calls to slash red tape to US policy shifts, momentum is moving in Europe’s favor.

Up next, here's how CEOs can reignite Europe’s global competitiveness and set the foundation for enduring innovation and growth."
2w,"For the first time in over a decade (pandemic aside), the personal luxury market is facing a lack of growth.

Ten years ago, the democratization of luxury led to extraordinary growth, with aspirational consumers — those spending less than €5,000 per year on personal and experiential luxury — accounting for nearly 75% of market value. Today, however, they represent just over 60%

BCG andhave partnered to explore what’s behind recent shifts in the sector and what will shape the way forward:"
2w,"As well as decreasing cost, AI can also help telcos identify new growth opportunities.

BCG'sshares how telecom leaders can break out of silos, focus on value creation, and drive the end-to-end transformation needed to stay competitive.

Read the full Q&A here:"
3w,"Global M&A activity in the first half of 2025 remained fairly robust, though it fell short of the strong rebound many analysts had anticipated.

Lingering market volatility and uncertainty, particularly prominent during the second quarter, tempered overall dealmaking.

Although conditions have undeniably grown more challenging in 2025, the long-term drivers of M&A remain in place.

Explore BCG’s Mid-2025 M&A Insights:"
3w,"BCG's Todd Bishop explores how retailers can navigate tariffs and highlights key strategic priorities they should focus on.

Read here:"
3w,"What if nickel could be extracted more quickly and cheaply than through traditional mining?

These specially enhanced crops can extract metals like nickel directly from the soil. The result is faster production, lower emissions, and reduced costs.

, a biotechnology company, is using synthetic biology to improve the ability of plants to extract battery-grade nickel with minimal environmental impact.

With support from BCG and, Genomines refined its strategy, accelerated growth, and scaled from a single plant to 95 million across hundreds of thousands of hectares annually.

Watch the full story:"
3w,"Europe’s heatwaves are making headlines. And drought is already affecting some regions. 

We need to prepare for a new normal when it comes to water use in Europe, says.

Read more."
3w,"Weak fundamentals are driving financial stress across Europe, with more than $300 billion in GDP at risk.

BCG’s Transform and Special Situations Index examined the operational performance and financial stability of more than 1,700 European public companies.

While tariffs and other external risks are aggravating existing vulnerabilities, CEOs should focus on strengthening their balance sheets to enter 2026 from a place of strength.

Learn more:"
3w,"Because of geopolitical pressures, Europe could be entering a period of renewed strength, from investments to innovation.

For Europe’s CEOs, this is a defining moment. Will they seize it—or squander it?

Learn more:"
3w,"Traditional retailers are transforming themselves by integrating online marketplaces, retail media, data monetization, and B2B digital services.

But the gap between leaders and laggards is already substantial. Reviewing the total shareholder return (TSR) of retailers between 2019 and 2024, BCG found that:

• The top quartile of global retailers by revenue materially outperformed the five-year TSR of total retail—16% for top quartile versus 9% for the overall retail industry.
• Approximately a third of this outperformance came from new revenue streams.

Learn more about transforming traditional retail here:"
3w,"The changing tariff landscape is accelerating innovation in the logistics, parcel, and shipping (LPS) sector.

As trade flows evolve and costs adjust, LPS providers have a chance to grow as strategic partners to their customers.

By focusing on smart adaptation and collaboration, providers can differentiate through:
• AI-enabled operations
• Flexible capacity
• Value-added services like warehousing and customs support

Explore the full report:"
3w,"Innovation is a competitive game. Over the past two decades, one megatrend has shifted the balance of power: the rise of China as an innovation powerhouse.

Europe, however, has struggled to keep pace. Only 9% of the region’s top innovators focus on technology hardware or software, compared to 19% in North America, 31% in China, and 19% in Asia-Pacific.

Read the 2025 Most Innovative Companies report to learn more:"
3w,"When wallets tighten, the hunt for deals intensifies. 
 
BCG’s survey of 16,000 consumers across nine countries reveals rising caution around spending, and a shift towards essentials. They want value-for-money, the ability to save, and low prices.

Read the full European Consumer Sentiment 2025 report:"
1mo,"When BCG published its first Most Innovative Companies report in 2005, the word ""digital"" didn't appear at all.

Since then, the rise of mobile, social platforms, the cloud, machine learning, and AI have reshaped how companies innovate and compete.

Over the past 20 years, venture capital has consistently provided early clues about where disruption is heading. Initially, the Internet of Things attracted the most VC interest. Today, GenAI and broader AI applications dominate the landscape.

Explore the findings of this year’s report:"
1mo,"With AI adoption on the rise, how can it help transform costs?

BCG research shows that 26% of companies have scaled AI in at least one function and are seeing faster growth, higher returns, more innovation, and stronger employee engagement.

More than half are established players in traditional industries. By rethinking talent, streamlining operations, and focusing on results, they are turning AI into lasting cost advantage.

Discover how AI is delivering real, sustainable savings:"
1mo,"This weekend, the expanded group of 10 BRICS nations will hold their annual summit in Brazil. 

Member countries (Brazil, Russia, India, China, South Africa, Egypt, Ethiopia, Iran, UAE, and Indonesia) make up almost half the world’s population, 27% of global GDP, and about a quarter of global trade.

Can they advance an international trade agenda that offers a credible alternative to the rising tide of protectionism?"
1mo,"⚡🍃 As Indonesia accelerates its decarbonization journey, upgrading the national grid is more than a technical requirement, it’s a strategic opportunity to unlock greater renewable potential, enhance reliability, and build a future-ready energy system that drives inclusive growth.

In their recent op-ed for The Jakarta Post, BCG’sandexplain why investing in grid infrastructure is essential to energizing a more sustainable future for Indonesia.

🖇️ Read the full article here:"
1mo,"AI is now a daily reality, but frontline employees are hitting an adoption ceiling. As AI goes mainstream, confidence is up, concerns are down, but frontline engagement is critical to unlocking value.

In our latest report we breakdown how companies can help break the “silicon ceiling”:"
1mo,"Space is no longer just about exploration. It’s a strategic domain unlocking economic growth, accelerating innovation, enabling climate action, and reshaping geopolitical influence.

As launch costs fall and private investment accelerates, governments are recognizing the value of space technologies as tools for national resilience, economic development, and global positioning.

In our latest report with, coauthored by,,,,, and, we explore why governments are making space a national priority and what it takes to lead in this fast-moving sector.

Read the full report:"
1mo,"What happens when a leading beauty company uses AI agents to transform the customer experience?

Together with BCG, this leading global beauty company launched an AI-powered beauty companion that delivers personalized, real-time product recommendations. Using multiple LLMs and skin diagnostics, it mimics in-store consultations while easing choice overload. The agent remembers preferences, enhances engagement, and unlocks new data and cross-sell opportunities for the brand.

In this new series, BCG explores how AI agents are quickly becoming a game-changing force in business. More than just a new technology, they represent a shift from AI as a tool to AI as a true teammate.

learn more about the impact that AI agents can have on your business:"
1mo,"How can companies turn a great product into a beloved brand? 

Carmen True of Qualcomm and BCG’s Lauren Taylor highlight the importance of meeting customers where they are."
1mo,"Transforming finance functions can be a quick and sizable way to reduce costs. And systematic programs can cut costs by 15% to 35%.

For CFOs, finance is the right place to start. It delivers impact, improves execution, and simplifies operations. This momentum can carry across the business.

With benchmarking, digital tools, and accountability, CFOs can replace legacy systems and unlock lasting savings.

Explore how CFOs can lead effective cost optimization:"
1mo,"What will drive the next $10 trillion in leisure travel spend?

BCG surveyed nearly 5,000 travelers across 11 countries and analyzed travel patterns in 68 markets to find out.

The real engine is close to home: domestic leisure travel is projected to generate nearly $12 trillion by 2040, while regional travel is set to triple to more than $2 trillion. International travel will grow the fastest but still hold the smallest share.

Learn more:"
1mo,"For Sara, leading with pride starts with being true to herself—and extends to helping others feel free to do the same. 

As Diversity & Inclusion Senior Manager for the Eastern Mediterranean and Caspian region, she sees leadership not as hierarchy, but as collaboration: creating space for people to express their potential, speak up, and challenge ideas when it matters most. At BCG, this kind of leadership is not only possible, it’s essential.

Read more about how Sara and other BCGers are leading with pride and authenticity:"
1mo,"How can media, data, and partnerships transform travel and earn customer loyalty?

Richard Nunn, CEO of United Airlines Mileage Plus and BCG’s Mark Abrahamdiscuss how businesses can captive audiences to create real opportunities."
1mo,"It's not just geopolitics, disruptive tech, or uncertainty from demographic and societal trends—there are more personal reasons that becoming a CEO is not the ultimate goal for a growing number of ""first team"" executives. 

is BCG's CEO Advisory lead for North America, and on The So What from BCG
recently, she explained the stresses of personal scrutiny, requests of facetime from senior staff and boards, and a growing expectation that CEOs will lead with empathy and vulnerability. Still, certain leadership styles lend themselves to being a good CEO, and Christine has the inside story."
1mo,"‘Rooted’ - that’s what Piyush Gupta would title his book on leadership.

In this candid conversation with Regional Chair Neeraj Aggarwal, the former DBS BankCEO shares why staying grounded in purpose and relevance is more than a nice-to-have—it’s the foundation of authentic leadership in volatile times.

Watch the conversation:"
1mo,"AI is poised to revolutionize healthcare with the potential to ease pressure on overstretched systems and personalize treatment at scale.

Progress, however, is being slowed by fragmented regulations, limited technical literacy, and outdated evaluation methods.

A new report developed between BCG and the World Economic Forum outlines a collaborative path forward that includes building technical capacity, modernizing regulatory models, and embedding evaluation across the AI life cycle.

Realizing the full promise of AI in health will require trust, coordination, and a pragmatic approach.

Read more:"
1mo,"BCG’s Center for Geopolitics helps businesses navigate high-stakes decisions, develop new strategic frameworks, turn geopolitical complexity into clarity and action.

Here are five key pieces we’ve developed over the past year to help businesses:
1. Great Powers, Geopolitics, and the Future of Trade:
2. Economic Statecraft Is Back. Here’s Why It Matters
3. The CEO’s Guide to Tariff Command Centers:
4. In a Multipolar World, the Global South Finds Its Moment:
5. Ten Forces Reshaping Global Business:"
1mo,"Are CMOs thinking about AI in the right way? That’s the critical question BCG senior partners are asking as they reflect on this year’s most unexpected moments.

Explore their insights and perspectives from the heart of the global marketing conversation."
1mo,"A new BCG Henderson Institute survey finds that most manufacturing leaders view exports as unprofitable when tariffs exceed 25%.

But cost is no longer the only concern. Nearly a third of leaders now prioritize labor quality and political stability over price, particularly in sectors such as medical and industrial equipment, where reliability is critical.

Read the full insights from the survey:"
1mo,"From calls to slash red tape to US policy shifts, momentum is moving in Europe’s favor, but CEOs must do their part now to jumpstart growth and innovation.

""Innovators succeed,” says, a BCG managing director and senior partner who leads the firm’s growth and innovation work globally. “And [they succeed] with an order of magnitude more when a CEO is behind an innovation pursuit.”

Read about the five actions CEOs can take now to turn Europe’s promise into a lasting competitive advantage."
1mo,"Which countries are the biggest magnet for AI and STEM talent?

See how the US compares to other countries: https://on.bcg.com/4nhIjL2"
1mo,"AI is at the core of The HEINEKEN Company's business, ""from the barley to the bottle,"" according to Chief AI Officer Surajeet Ghosh.

Surajeet and BCG’sexplain why prioritizing high-impact use cases and transforming core processes are key to scaling AI effectively.

Watch the full interview from
:"
