timestamp,post
1mo,"Which countries are attracting the world’s top professionals?

BCG’s Top Talent Tracker ranks the ten leading global talent hubs, based on the cross-border movements of more than 205 million highly skilled people.

Global talent is still moving, but at a slower pace. In the past 12 months, 2.6 million professionals moved across borders, representing about 1.3% of the total tracked. That’s a 0.4% decline from 2023 to 2024. STEM and AI talent, however, are moving at higher rates.

Learn more:"
1mo,"Building strategic and annual plans is one of the toughest challenges for CEOs right now. But those who don’t proceed may well sacrifice competitive advantage and resilience down the road.

Here are five ways to keep moving forward in uncertain times:"
1mo,"Is the decline in ultraprocessed food sales a passing phase or the beginning of a $2 trillion realignment in global consumer demand?

Three forces are reshaping demand: growing awareness of nutrition, stricter regulation, and the rising use of GLP-1s, medications that help manage weight and influence food choices.

CPG companies must act. Adapting products and portfolios is no longer optional. Those that innovate now will shape the future of the industry.

Read more:"
1mo,"How soon could a robotaxi service be coming to your city?

This new report from BCG and [@] WEF provides a refined forecast for the adoption of self-driving vehicles, including autonomous trucks, robotaxis, and personal vehicles.

The forecast incorporates key factors such as consumer trust, pricing, policy frameworks, and technological maturity to identify inflection points for adoption.

Explore the report to learn more about promoting the safe, ethical, and user-centered rollout of autonomous mobility:"
1mo,"Join us live from Cannes Lions International Festival of Creativity for a candid conversation on what it takes to lead in a tech-driven era. AI may no longer be new, but it continues to reshape how CMOs operate—amplifying capabilities, surfacing new challenges, and demanding faster, smarter decisions.

In this LinkedIn Live session, we’ll hear from(GVP of Ads Marketing & Centers of Excellence, Google),(CMO of AI, Salesforce), and(CMO, BCG) as they discuss:
- How AI and emerging technologies are enhancing (and complicating) the CMO role.
- What it takes to stay ahead amid continuous disruption
- Where the most exciting opportunities lie for creating long-term brand and business value

Whether you're experimenting with new tools or scaling AI across your organization, this is a conversation you won’t want to miss."
1mo,"How is AI already transforming the customer experience at Microsoft?

Speaking live from the BCG studio in Cannes, Microsoft’s Stephanie Fergusonshared how AI-powered conversations are personalizing customer experiences and building deeper trust."
1mo,"Commerce media is transforming traditional advertising by delivering targeted, contextual, and highly relevant messages to customers.

BCG expects commerce media to quickly become an integral element of strategies for business growth.

Find out more about how to make a commerce media business successful."
1mo,"From the BCG studio in Cannes, Salesforce’s Joseph Inzerillo and BCG’s Jean-Manuel Izaret (JMI) unpack how AI is transforming customer experience, pricing, and business models.

Stay tuned as we continue to share insights from business leaders who are shaping the future, live from the."
1mo,"When it comes to building their personal brand online, leaders should share both their insights and what they’re still figuring out, with honesty and humor. That’s according to LinkedIn’s Jessica Jensen. Listen to her conversation with BCG’sat the."
1mo,"Day 2 of the 2025 Cannes Lions International Festival of Creativity, and we’re live from the BCG Studio sharing fresh insights. As 7-Eleven’s Marissa Jarratt puts it, AI helps transform rich data into faster insights, freeing up more time for marketers to focus on human-centered solutions."
1mo,"The Cannes Lions International Festival of Creativity is in full swing, and BCG’s Joanna Stringer shares key highlights to watch this week. As an official partner of Cannes Lions, BCG is at the forefront, leading conversations and offering bold perspectives on the trends that are redefining the future of marketing."
1mo,"Day 1 at the Cannes Lions International Festival of Creativity 2025.

We look forward to hosting an intimate, confidential space for CMOs, a place to breathe, create, and gather. Our BCG delegation will bring to the festival deep expertise, knowledge, and experience across sectors.

See you there."
1mo,"As marketers gather in Cannes, new research from BCG confirms that AI and GenAI remain at the top of the CMO agenda.

Strong momentum, driven by successful pilots and a steady stream of new tools, is accelerating investment and raising expectations for revenue growth.

As the technology becomes more embedded in the marketing function, CMOs are prioritizing pilot areas such as immersive content creation, personalization, and agentic AI.

Explore all the insights from BCG’s survey of 200 CMOs:"
1mo,"When Theo Breward stepped into his role as the Middle East node for BCG’s GenAI Enablement Network, he wasn’t just adopting new tools — he was driving change.

His mission? Help 1,500+ BCGers across the region integrate GenAI into their work in meaningful, secure, and scalable ways. From training to capability building, Theo’s work is reshaping how teams work, collaborate, and grow.

Learn how Theo and the Enablement Network are powering a GenAI-first ways of working at BCG:"
1mo,"Even well-executed corporate transformations can fall short when value fails to reach the bottom line.

Investors expect clear profit and loss impact. But inflation, shifting demand, and reinvestment can cut gains by 10–20%, putting valuation and leadership credibility at risk.

Strong financial oversight through early risk management, execution discipline, and buffered targets helps business leaders protect value and ensure consistent results.

Read more here:"
1mo,"Deeptha Khanna of Philips and BCG’s Diederik Vismans agree: identifying consumers’ unmet needs and enhancing their experience are key to product development. 

Watch their full interview from
now:"
1mo,"The CEO Radar is a tool for CEOs to compare their own agendas to those of their peers, as well as the market as a whole.

Featuring,, and others, each episode analyses Bloomberg’s quarterly earnings call data to understand what’s important for CEOs at the world’s largest companies.

Available to watch and listen to on Bloomberg:"
1mo,"How does a consumer goods giant like Reckitt supercharge productivity with GenAI?

""We're going to go fast and we're going to stay humble,"" says CEO. Despite market uncertainties, consumers remain engaged, and AI is helping companies deliver more productivity, consistency, and value.

Reckitt has achieved impressive results:

• Up to 40% of employee time freed for higher-value work
• 60% efficiency gains across media, insights, innovation, and more
• Hundreds of team members using custom GenAI tools daily


Watch the full interview from the studio at
:"
1mo,"Scaling GenAI in turbulent times is the challenge and the opportunity facing CMOs in 2025.

Marketing leaders are pairing high expectations with high levels of investment. Personalization, predictive analytics, and measurement are rising to the top of the agenda. Agentic AI is gaining ground as a strategic focus.

BCG’sshares how forward-thinking CMOs are meeting the moment."
1mo,"At BCG, Daniel leads with the mindset that inclusion starts with intention. 

As a Senior Administrative Assistant in our Atlanta office, Daniel creates space for connection by showing up as his full self—and encouraging others to do the same. He knows that when people feel safe and supported, they’re empowered to bring their best forward.

For Daniel, inclusion means using his presence to help others feel safe, seen, and empowered."
1mo,"✅ Changing customer journeys. 
✅ Reformulation. 
✅ AI-powered transformations. 
✅ Influencer marketing.
✅ Gen Z.

These are the factors that are redefining the retail and consumer goods industry.

After two days of conversations and insights at
,asked,,,, andabout the trends that are redefining retail and consumer goods."
1mo,"The modern CMO has a lot to prioritize in 2025, but the tools to help and power growth are becoming clearer.

According to, ""AI has become a source of optimism for CMOs. It’s the one thing that can simultaneously address all their needs.""

In this special edition of Up Next, Jessica shares her take on what's inspiring her and other CMOs ahead of thenext week."
1mo,"How does Dirk Van de Put of Mondelēz International stay focused and resilient in the face of shifting consumer expectations, AI transformations, and geopolitics?

Create an organization that's ready for anything, which is no simple feat for a CEO.

He joined BCG'sin the studio at
to discuss how resilience has become a priority for CEOs across the consumer goods industry."
1mo,"$50 billion. 
 
That’s the total estimated cost of the new 50% tariffs on steel and aluminum imports into the US which came into effect this month.

Learn more about how the tariffs are changing the dynamics of the global metal industry:"
1mo,"Cost programs are easy to launch but hard to sustain.

A recent BCG survey found that nearly half of Chief Operating Officers (COOs) saw costs creep back up after previous reduction programs.

To sustain performance, COOs are focusing on deeper strategies. By collaborating across functions, adopting GenAI, and partnering with external providers, companies can achieve lasting efficiency and agility.

Discover how operations leaders are driving smarter, more sustainable cost impact:"
1mo,"CMO confidence in GenAI is higher than ever.

In BCG’s new survey of 200 marketing leaders, 71% plan to invest more than $10 million annually over the next three years, up from 57% last year.

Many are beginning to scale use cases with the greatest growth potential. More than a third already report improvements in customer experience, and content quality and volume. Fewer cite efficiency gains, reflecting the challenge of scaling GenAI across workflows.

Learn how CMOs can move from pilots to performance gains:"
1mo,"M&A sentiment bounced back in May, with the strongest monthly increase so far this year hinting at renewed confidence at a global level.

Europe and the Americas led the turnaround. But in APAC sentiment declined further, to the lowest level on record.

Explore the M&A Sentiment Index for further analysis by region and industry:"
1mo,"Concern about Europe’s economic future is deepening. So too is the resolve to act.

A new BCG study of 850 C-level executives in 20 countries reveals a decisive shift in sentiment across the region. With Europe’s competitiveness under pressure, business leaders are paying close attention.

BCG’sunpacks the consequences leaders foresee if current trends persist."
2mo,"Does your company have the team-level “AI influencers” who can accelerate adoption? 

That was one of the questions posed at this week’sAI + Summit NY, where BCG hosted a panel discussion about how AI is shaping business.

While interest in AI is high, many companies remain in the early stages of maturity. Common hurdles include unclear strategies, fear, and overreliance on generic tools. Real momentum often comes from influencers who drive adoption through practical, low-risk use cases. Executive engagement and a culture of experimentation are key to scaling success.

The roundtable, moderated byand, highlighted a gap between AI’s potential and organizational readiness, in a number of sectors. Leaders emphasized the importance of pragmatic, gradual adoption, listening to sceptics, and focusing on real-world integration. Companies that approach AI with transparency and discipline will build both trust and a competitive edge.

Unlock your AI advantage by exploring how top execs are turning ambition into action:"
2mo,"When Michaela Ginter co-led a bi+ breakout group at BCG’s 2024 Pride Conference, she saw just how powerful it can be to create space for others to be fully themselves. That experience became the foundation for Bi and Beyond, a growing community within BCG focused on bi+ inclusion and belonging.

Now a Concierge Specialist in BCG’s Los Angeles office, Michaela continues to lead by example, showing that inclusion is something we practice every day.

This Pride Month, we’re celebrating leadership, and celebrating the people who lead by lifting others up."
2mo,"Consulting = solving complex problems with the right people by your side.

For Chad Castle, the best part of consulting is tackling tough challenges with a network of experts who bring different experiences and perspectives to the table.

Want to work on challenges that push you forward? Explore career opportunities at BCG:"
2mo,"BCG is working with COWI’s leadership to accelerate performance while preserving its purpose-driven culture.

COWI, a global consultancy in engineering, architecture, energy, and the environment, co-creates sustainable solutions that improve lives.

In a recent conversation, BCG’sand COWI CEOdiscussed how the company is operationalizing its purpose, fostering collaboration, and planning for growth while upholding its values.

Watch the video to learn three strategies for sustainable, purpose-led transformation:"
2mo,"Today we announce the open-source release of GAIA Foundation Model (Geospatial Artificial Intelligence for Atmospheres), built by BCG X AI Science Institute and USRA’s Research Institute for Advanced Computer Science’s (RIACS) team of data scientists, engineers and AI experts in collaboration with.

GAIA is trained and tested on 25 years of satellite data from a global constellation that includes the Geostationary Operational Environmental Satellites (GOES), Europe’s Meteosat (EUMETSAT), and Japan’s Himawari satellite.

Reliable, continuous satellite observation of Earth is essential to many real-world systems—extreme rainfall, severe flooding, and hurricane predictions are just a few examples. GAIA Foundation Model demonstrates promising capabilities in seamlessly patching large gaps in satellite records, while also translating imagery into precipitation estimates.

For scientists and meteorologists monitoring our weather systems, models like GAIA represent an exciting new avenue for delivering more timely and informed decisions, with significant impact across sectors such as insurance, power utilities, aviation, and agriculture.

Learn more about GAIA Foundation Model:"
2mo,"Rapid AI advances, evolving consumer behaviors, and mounting costs are transforming the consumer products and retail industries, and the role of merchandising must change significantly.

Our recent survey revealed a vision for the nature of the transformation needed; the gap between the current and envisioned state requires a focus on both people and technology.

Next month, BCG will bring a delegation of experts to the
in Amsterdam to discuss the game-changing trends and innovations shaping the industry. Learn more about our programming and meet our delegation here:"
2mo,"BCG EDGE is where innovation meets impact, uniting thought leaders, tech partners, and breakthrough tools.

At the EDGE Expo, attendees explore the future of tech and AI, discover new value-creation strategies, and experience cutting-edge solutions firsthand.

Stay tuned for updates from the EDGE Expo."
2mo,"At first glance, 2024 looked like a comeback year for banking. Profits rose and investor confidence returned. But the recovery was largely driven by external factors, and core business models remain vulnerable.

BCG’s new report, Fit for Growth, Built for Purpose, warns that traditional banks are at risk of being sidelined by rising fintech and nonbank challengers.

The report highlights four strategic approaches that today’s banking leaders are already pursuing – all of which require strong digital capabilities.

As BCG’sexplains, AI adoption at scale can push the frontiers of digitization to a whole new level."
2mo,"A new BCG survey about Europe’s competitiveness reveals the hopes and fears of business leaders. 

Find out more:"
2mo,"Sustainable food means more than just protecting the environment. There are also choices around sourcing locally, fair labor, animal welfare, and packaging.

BCG’sand Sysco’sdiscussed this topic over dinner. They highlighted the role of local sourcing in reducing carbon emissions and strengthening regional economies.

Consumers can support sustainability by choosing local, sustainable foods and adjusting their consumption habits.
And companies will adapt to meet the growing consumer demand for cost-saving products.

Success requires collaboration from both sides.

Watch the full video here:"
2mo,60% of business leaders recently surveyed by BCG said forming joint ventures and partnerships will be more critical for growth over the next three to five years than pursuing M&A. Explore the five steps CEOs can take to drive JV success:
2mo,"A tariff command center can protect hundreds of millions of dollars in revenue and profits against potential fallout.

Think of it as a “situation room,” complete with charts and dashboards to track developments in real-time. And this need is urgent: Levy increases (amid evolving deals and pauses) impact approximately $1.8 trillion worth of traded goods.

Here's how tariff command centers can help CEOs build more resilient businesses and turn volatility into a competitive edge."
2mo,"BCG has released its Annual Sustainability Report, Scaling Impact in a Changing World. As well as showcasing the positive impact the firm delivers with our clients, it highlights internal progress. In 2024, BCG reduced our GHG emissions per employee 58% compared to 2018, and stayed on track to neutralize 100% of residual emissions by 2030.

In addition, BCG continues to prioritize employee well-being and development earning over 60 employer awards for our high-performance workplace in 2024.

Read more about this and more in the full report:"
2mo,"How can clients get more value faster, and take advantage of the powerful technology at their disposal? BCG's Allon Glaser, he/him shares his observations from 
hashtag
#SAPSapphire."
2mo,"From high-protein snacks to wellness drinks, consumer preferences are changing fast. 

That means many established consumer goods firms need to reinvent their innovation strategies to avoid losing ground to challenger brands.

Here’s how:"
2mo,"SAP Sapphire is underway here in Orlando. BCG's delegation unpacks today's events as they unfolded.

All eyes are on AI Agents, as BCG’sandshared the unique approach to driving value from AI and Agentic workflows.

Providing a strategic lens on the week's development, BCG will be sharing daily highlights.

Stay tuned."
2mo,"When Viviana Moriggi joined BCG in 2020, she was onboarded remotely and wasn’t sure what to expect. What she found was a united team that empowered her to grow—and trusted her to lead.

As a Senior Executive Assistant, she’s built connections across teams, mentored new colleagues, and helped shape how her team collaborates globally.

See how Viviana helped build a go-to resource for her team and found new ways to grow her career along the way:"
2mo,"What are the challenges that governments face today and how is AI uniquely positioned to address them?

’s, explains how AI can cut through bureaucracy, boost efficiency, and build trust in government.

Read the full article here:"
2mo,"While summer is only weeks away, companies are looking ahead to the holiday season. With tariff uncertainty mounting, leading retailers are shifting from reaction to readiness. 

BCG’sjoinedEvening News to outline how companies are staying ahead by:
◾ Navigating rising input costs
◾ Reconfiguring supply chains
◾ Standing up “command centers”

Watch the full segment to see how retail leaders are preparing for what’s next:"
2mo,"Would you rent your bike? Or take it back to the shop for repair?

These are some of the ways sporting goods brand Decathlonis making sport more sustainable. With BCG’s support, Decathlon accelerated its circular transformation across four key areas: repair, second-hand, rental, and recycling.

Over five months, they identified market opportunities, defined the capabilities needed to scale, and built a roadmap for profitable growth—ultimately leading to more than one million second-hand products sold and buy-back programs in 23 countries.

Decathlon’s journey shows how circularity can unlock growth, deepen customer engagement, and improve profitability while reducing environmental impact.

See the video for how BCG collaborated with Decathlon:"
2mo,"Imagine a dedicated facility to understand the implications of evolving trade policy—complete with charts and dashboards—that track developments and simulate their impact.

This is a tariff command center. It helps CEOs steer businesses toward the best possible outcomes.

Up next, here's a three-phase approach to help leaders build an informed, action-oriented plan."
2mo,"New BCG projections suggest that US passenger and light vehicle sales could fall from 15.1 million this year to 14 million in 2026, before recovering in 2027.

Underlying forces, like tariff shifts and supply chain friction, could have long-term effects across the industry.

Read the full analysis and explore the three tariff scenarios here:"
2mo,"Customers are watching prices more than ever.

This is according to Sonya Gafsi Oblisk of Whole Foods Market, which is working closely with suppliers to manage costs and make investments to bring prices down."
2mo,"The energy transition relies on physical resources like aluminum, boron, and graphite. But will there be enough to advance climate goals?

In her, BCG’s Marielle Remillard explores the material constraints of the energy transition. She explains how design choices, supply bottlenecks, and substitution strategies will shape sustainability outcomes and major industrial and economic opportunities.

Watch the full talk here:"
2mo,"What defines a top value creator in today’s market?

BCG’s 2025 Value Creators Rankings track long-term Total Shareholder Return (TSR) across 2,345 companies and 35 industries, offering a data-driven view of what it takes to outperform through volatility.

From Asia-Pacific’s dominance in the top 100 to a surprising surge in traditional industrial sectors, the findings show that value creation is no longer concentrated in one region or sector.

More than a leaderboard, the report explores the strategic behaviors and introduces corporate vitality as a new way to assess who’s positioned to lead next."
2mo,"Tariff turmoil may stifle M&A deal enthusiasm for now, but it won’t last forever. BCG research has found that deals made during down markets generate higher returns on average.

These five deal archetypes are likely to dominate once dealmaking rebounds. Whichever the type of deal, CEOs will need to be savvy to prepare for whatever the global economy throws at them."
2mo,"According to BCG's Vladimir Lukic ""Tech needs to be at the core of any business that wants to compete today."" 

At the Milken Institute Global Conference 2025, he shared how companies can make that a reality from building foundational tech and AI literacy to rewiring incentives and workflows to keep pace with change.

Watch the full conversation!"
2mo,"No quarter given: While CEOs scramble to respond to the threat of higher tariffs, investors are still holding them to their earnings forecast. Supply chain resilience, profit margins, and debt levels are also under scrutiny."
2mo,"AI agents are distinguished by their ability to act — to observe, understand, plan, and do. They unlock transformative value far beyond simple automation, helping companies achieve their most important business objectives.

In our latest article, we explore why companies should embrace AI agents and how these technologies can be used to reshape core business processes."
2mo,"Join us at 
hashtag
#SAPSapphire in Orlando to see how BCG is helping organizations build lasting competitive advantage with SAP. From Agentic AI to ERP modernization, our experts will share how we’re turning vision into value faster, smarter, and more sustainably.

Follow for insights and learn more about the BCG and SAP's partnership:"
2mo,"92% of major cyberattacks start with an email. 

As AI continues to transform how we work, it's also arming cyberattackers with new tools—accelerating the speed and sophistication of their attacks.

At
,, CEO atjoined the BCG Studio to discuss a growing concern: traditional cybersecurity strategies aren’t evolving fast enough to meet today’s AI-powered threats.

Watch the full conversation."
3mo,"With long lead times, locked-in pricing, and high uncertainty around tariffs, decisions made today will determine not only what customers see this holiday season but how profitable it will be.

BCG’sbreaks down how retailers should adapt based on how important seasonal sales are to their business:

▪️ If seasonal is a small part of your sales: Consider dramatic cuts, dynamic pricing, and flexible merchandising plans.

▪️ If seasonal is central to your business: Buy conservatively but protect your core holiday products. Build agility into pricing and localization strategies.

▪️ If you're somewhere in between: Model for extremes and prepare now to flex in-season.

Check out the full article to learn how actionable strategies now will help deliver festive holiday experiences:"
