timestamp,post
4mo,"In 2024, US spending on pets is estimated at $151 billion, up just 2.5% from 2023, signaling a slowdown after years of rapid growth.

But opportunities remain:
▪️ Premium pet food (human-grade, freeze-dried, or nutrient-dense) is growing in the high single digits through 2029.

▪️ Pet supplements—for joint health, anxiety, and allergies—are projected to grow 10% annually for dogs and 12% for cats through 2028.

▪️ Luxury pet services—from wellness spas to concierge care—are gaining traction, especially among high-net-worth owners.

With 80% of pet owners considering their pets family, the next big opportunity lies in the continued humanization of pet care. How can brands and investors adapt?

Explore BCG's insights:"
4mo,"Supply chain costs make up a significant share of operating expenses for companies that produce or transport goods. With inflation, shifting trade routes, and other pressures squeezing margins, finding ways to cut supply chain costs is crucial.

To help companies understand where to start, BCG, in collaboration with operations leaders across industries, has identified five key measures to optimize supply chains.

Read more here:"
4mo,"How will AI reshape procurement? 
 
The latest edition of BCG’s Executive Perspectives serves as a guide for CEOs and procurement leaders looking to cut through the hype and understand what drives value—both now and in the future."
4mo,"For years, extended reality (XR) has waited to find its place in business. New lightweight, AI-enabled headsets are bringing the power of AI to the frontline.

In this special episode of The So What podcast filmed in the BCG Studio at,explains how XR can boost productivity and address labor shortages. But will workers embrace it?

🎧 Listen now to find out:"
4mo,"According to BCG research, costs were top of mind for CEOs leading into 2024—and they still are in 2025. 

Here's how CEOs can rein in costs, harness new technologies, and strengthen their organization’s culture to achieve their strategic objectives."
4mo,"Resistance to change is a significant challenge in implementing effective cost management. The biggest obstacle to success is the misalignment between cost-saving initiatives and organizational culture.

Learn how companies can overcome this barrier and drive sustainable savings.

Read the full report here:"
4mo,"After a year of elections around the world, what's next for the energy transition?

BCG has reviewed the contests in India, Indonesia, Mexico, South Africa, the UK, the US, and the EU. High energy prices, the cost of living and economic growth were clearly on voters’ minds as they went to the polls.

We believe the results reflect and accelerate three dynamics in energy policy.

Read our report to find out more:"
4mo,"Attracting talent is just the beginning—retaining and developing it in an AI-driven world is the real challenge. Jens Baier shares how HR can stay ahead with strategic workforce planning and dynamic skill modeling on The So What from BCG 
hashtag
."
5mo,"What will New Zealand be known for in 2050?

This newly-launched report from BCG New Zealand, led by Managing Director and Partner, identifies five ecosystems that could hold the answer to unlocking the country's competitive advantages in the coming years.

The report asks the questions:

➡️ Which industries should NZ Inc bet on for future growth?

➡️ Who should be making these decisions?

➡️ How can investment stimulate the innovation needed to keep NZ globally competitive?

Read more:"
5mo,"Live from Mobile World Congress in Barcelona, join BCG's Val Elbert and Verizon Business's Aparna Khurjekar as they discuss how AI is already transforming operations and customer experiences, what agentic AI really means—and why it could be a game changer—and the strategies leaders need to close the AI impact gap."
5mo,"What separates the AI Leaders from the AI Laggards, and how should businesses use AI-driven products to bring a fresh perspective to longstanding network problems? 

BCG’sandtake a closer look at all things AI and Telco from
."
5mo,"AI-human collaboration will streamline the telco industry by rethinking processes, serve customers, and manage and build networks. 

This is according toofwho joined the BCG Studio to discuss how the future of telcos. Stay tuned for more insights live from
."
5mo,"This month, more than 20,000 pet professionals will gather in Florida to discuss the latest trends in the pet care industry. 

From wellness spas to better nutrition, innovation is key."
5mo,"What’s on CEOs’ minds in 2025?

BCG and Bloomberg Media Studio's CEO Radar explores key signals shaping the future.

Join BCG CEOand, head of BCG’s CEO Advisory, as they discuss Q1 insights withof Bloomberg Media Studios.

Listen now!"
5mo,"Looking to make an impression at 
hashtag
#MWC25? Here’s the only reading list you’ll need to prepare.

📈 2025 Telco Value Creators Report:

⚖ As GenAI Investment Grows Other IT Projects Get Squeezed:

☁ A Smart Way for Telcos to Accelerate Their Cloud Strategy:

➡️ Future-Proofing Telcos With Smart M&A:

📲 In a Crowded B2B Market, the Middle Is a Strong Option for Telcos:

BCG will have a team of experts on the ground ready to share their perspectives on the action. Check outto learn how you can get involved, whether remote or in-person."
5mo,"Dealmaking sentiment has been generally subdued at the start of this year amid economic uncertainty, but momentum is building in some sectors and regions. 

Up next, BCG’s M&A Sentiment Index indicates where the market is pointing."
5mo,"From AI to M&A, leading telcos are showing that the right strategy can deliver results—even in a challenging market.

So which telcos have delivered most shareholder value over the past 5 years?

BCG’s annual analysis of the industry identifies the top performers—and how they’re driving growth.

Discover the 2025 Telco Value Creators Report here:"
5mo,"Join senior BCG automotive experts for a LinkedIn Live discussion on how industry leaders can rethink their cost structures and embrace innovation to stay ahead.

▪️Cost & Margins – Why traditional approaches aren’t enough
▪️Global Competition – How shifting market dynamics are reshaping the industry
▪️Innovation & AI – The technologies and partnerships unlocking new opportunities

Register now."
5mo,"More CFOs than ever are stepping into CEO roles—7.1% of Fortune 500 and S&P 500 CEOs in early 2024 came from a CFO background, up from 5.3% in 2013.

But financial expertise alone isn’t enough. The CEO role demands vision, adaptability, and a willingness to take risks. As, who leads BCG’s Center for CFO Excellence in North America, explains—CFOs who rely too heavily on numbers risk missing critical factors like strategy, talent, and culture.

The key to a successful transition? Developing cross-functional experience early, owning P&L responsibilities, and honing leadership skills beyond finance.

Read more in:"
5mo,"Cost management is a priority for all companies, but no single strategy works for every organization. Businesses must tailor their approach to enhance areas that provide a competitive edge.

To stay ahead, executives are focusing on workforce productivity, improving supply chain efficiency, and refining product portfolios to drive cost-effectiveness.

Read the full report here:"
5mo,"A fun one—great to chat with Louise Moon from Bloomberg News UK for The London Rush.

We covered a bit of everything over coffee: why B2C is where my heart is, how retail and healthcare are ripe for reinvention, and why I’ve fully let go of staying on top of emails (WhatsApp me instead).

Also, the career advice I wish I’d heard earlier? It’s okay to be your most authentic, unpolished self.

Full piece below:"
5mo,"Choosing the right workplace is about finding an environment that empowers you to thrive. 

At BCG, we’re committed to supporting professional growth, work-life balance, and purpose-driven careers. Learn more about how we put people first:"
5mo,"How do physical spaces shape culture and drive productivity? 

At the Steelcase WorkLife Center Showroom, BCG's Sharon Marcil and Sara Armbruster, CEO of, shared an interesting conversation about the company’s innovative approach to workspace design.

From fostering employee well-being to embedding sustainability into every decision, Steelcase is redefining what it means to create environments where people and ideas thrive.

Check out the new episode of the Leadership Compass:"
5mo,"Global demand for batteries is rising, but not as fast as market experts anticipated. Overcapacity and low utilization are expected to intensify price competition.

Operational efficiency is becoming critical.

Manufacturers are reducing conversion costs by leveraging AI, automation, and lean processes. As investment feasibility varies, companies must make strategic decisions tailored to their circumstances to ensure success.

Read more about the battery cell factory of the future:"
5mo,"The shift to clean energy is more critical than ever—but how are companies funding it?

Live onTrade Talks,from BCG’s Center for Energy Impact shared insights on how businesses can meet their energy goals by 2030.

1. A coordinated strategy is essential for success. With evolving technologies and regulatory landscapes, companies must build resilient frameworks that can adapt to external changes.

2. Private investment plays a pivotal role in bridging the capital gap in clean energy. Additionally, end-user investments—including consumer and industrial spending—can help accelerate the transition.

As energy companies navigate the balance between low-carbon investments and maximizing returns, the path forward demands innovative financial solutions.

Watch the full interview to learn more:"
5mo,"There is no end to the demands on a CEO’s time. So, when should they get directly involved with a situation or decision impacting their company? BCG Global Chair Rich Lesser along with BCG CEO Advisory leaders Christine Bartonandexplore six areas where CEOs are uniquely positioned to make a difference for their organization."
5mo,"Dr. Andrej Levin's childhood passion for data is shaping the future of the automotive industry.

Auto AI bysimplifies pricing strategies, optimizes inventory, and improves quality—all powered by real-time analytics. The customized solutions focus on value, speed, and scale, and are guided by proven use cases.

Learn more:"
5mo,"Companies that fail to meet their cost reduction targets are falling short for their shareholders. A recent BCG survey found they underperform on total shareholder return (TSR) by 9 percentage points.

But cost efficiency isn’t just about cutting budgets—it’s about transforming how businesses operate for the long haul.

Learn more about making cost savings stick:"
5mo,"A third of executives say cost management is a top priority—an 8-point jump from 2024. 

Up next, see how leading companies are driving growth and turning cost discipline into a competitive edge."
5mo,"Around 80% of fashion brands don’t have clear sustainability goals, despite regulatory demands, higher costs, concern for the planet, and changing consumer tastes.

Next-gen materials can reduce the environmental impact, lower costs, and drive innovation. But adoption at scale remains a challenge.

A BCG andreport, outlines three levers for success:

1. Demand – Long-term brand commitments stabilize markets and attract investment.
2. Cost – Process improvements and supplier collaboration drive affordability.
3. Capital – Strategic funding ensures growth and adoption.

Read more about how brands that move now will lead the future of sustainable fashion:"
5mo,"BCG is officially #1 on Vault's Top 50 Consulting Firms list for 2025! 
 
This ranking is based on insights from thousands of verified consulting professionals, highlighting BCG as a respected destination for talented individuals in the industry. It showcases our commitment to meaningful client impact and a strong workplace culture.

Highlights from this year’s rankings include:
💡 #1 in Innovation
🌱 #1 in Environmental Sustainability
💼 #1 in Consulting Benefits

Learn more about life at BCG:"
5mo,"Innovation, resilience, and loyalty are three of the driving forces behind Pret A Manger's journey to success.

As AI makes its mark on the retail industry, CEOdiscusses his strategy and what he’s focused on for the future.

Watch the full interview with Pano and other CEOs to learn how your peers shape their CEO agenda:"
5mo,"A decade of growth, resilience, and impact.

From joining BCG 10 years ago to becoming a Managing Director & Partner at BCG Middle East,’s journey is a testament to leadership and perseverance.

🎥 Watch his story in the latest
."
6mo,"Corporate dealmaking is poised for growth this year, BCG’s CEO Christoph Schweizer tells the Financial Times.

“There has been pent-up demand” for mergers and acquisitions, he argues, partly because “private equity has a lot of dry powder they . . . need to deploy”. Buyout firms are looking to exit some investments after sitting on their portfolio companies “for an unusual length of time”.

For further insights, read BCG’s newly published M&A Outlook 2025 article."
6mo,"BCG is joining forces with Quantis for 
hashtag
#GreenBiz25, and our delegation is looking forward to engaging with sustainability leaders on some of today’s most pressing climate topics—including the cost of climate inaction and sustainable growth. 

If you’re attending GreenBiz, we invite you to attend our lunch panel on Tuesday, February 11th: Risk to Resilience: Building Future-Proof Global Supply Chains. This interactive session will provide practical guidance on assessing risk exposure and identifying strategic, no-regret moves to gain a competitive advantage.

Register here:

Stay tuned for the latest insights from the event!"
6mo,$150 trillion. That’s the amount needed to finance the energy transition over the next 30 years. So where’s the money going to come from? Tune into The So What podcast to find out. https://on.bcg.com/4hKUJrn
6mo,"BCG will be at MWC Barcelona for an unforgettable experience with the brightest minds in telco, tech, and digital innovation.

Dive into the opportunities within the digital ecosystem and discover the winning strategies in digital engagement, AI, and more with our experts:"
6mo,"How will proposed tariffs impact the cost of goods imported by the US? Which sectors will be the hardest hit? And how should businesses prepare now for ongoing disruption that could well redefine the future of trade? 

Read the latest analysis from BCG’s trade experts:"
6mo,"In a thought-provoking TED@BCG Talk, Alexandra Amouyel, President and CEO of Newman's Own Foundation and BCG alum challenges the audience to imagine a world where businesses are created not to optimize click rates or drive shareholder value, but to maximize impact.

What is possible when purpose drives innovation?

Discover her powerful vision for transformation — starting with something as simple as salad dressing.

Watch the full talk here:"
6mo,"Over the past five years, BCG’s 600 global procurement experts have supported around 1,500 companies in reducing costs through procurement transformation, typically improving earnings before interest and taxes (EBIT) by 2 to 4 percent.

By leveraging AI-driven tools, BCG helps organizations optimize contract negotiations and establish new cost baselines, driving lasting value across industries.

Find out more from our experts in the video here:"
6mo,"The biopharma sector is in a unique moment.

Unparalleled understanding of human biology combined with novel therapeutics is enabling transformative treatments. Technologies such as artificial intelligence are poised to accelerate drug discovery and development.

The industry is rapidly evolving, but BCG believes biopharma companies can navigate and thrive amid these complexities.

Read our Biopharma Trends 2025 report to find out how."
6mo,"The global demand for computing power is soaring, driven by AI growth and digital transformation. Data center operators are planning to invest $1.8 trillion from 2024 to 2030 to meet the need, but challenges remain:

· Power needs will reach 130 GW by 2028, with GenAI driving 60% of growth.
· Power grid limitations and supply chain disruptions could slow progress.
· Rising energy consumption emphasizes the need for sustainable solutions.

Operators, regulators, and communities must unite to improve power planning, accelerate grid upgrades, strengthen supply chains, and lead in clean energy and new technologies.

Read more:"
6mo,"🤖 L'intelligenza artificiale ridisegna le strategie aziendali a livello globale, ma non minaccia i posti di lavoro.

Secondo l’ultimo
di
, il 75% delle aziende globali considera l’
una delle tre principali priorità strategiche per il 2025 e solo il 7% prevede una riduzione dell’organico dovuta all’automazione.

E in Italia?

👉 Il 69% delle aziende vede l’AI come una priorità, ma solo il 25% riesce a generare valore significativo dalle proprie iniziative

👉 L’83% delle aziende prevede di spendere fino a 25 milioni di dollari in AI nel 2025 (vedi grafico)

👉 Ben il 37% delle imprese non monitora alcun KPI legato all’AI

Quali sono le leve per sbloccare il potenziale dell’AI in Italia?

1️ Formazione: solo il 20% delle aziende italiane ha più del 25% della forza lavoro formata sull’AI

2️ Investimenti: oggi il 44% degli investimenti è destinato all’implementazione, ma servono più risorse per innovazione e sviluppo

3️ Progetti strategici e misurabili: puntare su meno iniziative, ma più mirate e strategiche, può generare un ROI fino a 2,1 volte superiore.

📥 Per approfondire, scarica il report completo:"
6mo,"After meeting in 
hashtag
#Davos last week, leaders have a much clearer perspective of how technology will impact their business, according to Ana Paula De Jesus Assis of IBM. And they are looking at how it may change society too.

In a discussion with BCG's, IBM's Ana Paula highlights the need to embrace hybrid cloud architecture, data governance, and agentic AI to boost tech efficiency. Watch the full conversation now:"
6mo,"Managing costs and protecting profit margins are top priorities for European businesses as they navigate regulatory changes, economic challenges, and shifting geopolitical dynamics.

According to BCG’s upcoming survey, leaders entering 2025 remain cautious yet steady. These are some of the areas they are focusing on:

• Building cultures of cost consciousness grounded in continuous improvement
• Reinvesting savings into innovation and growth
• Leveraging AI to enhance decision-making and operational excellence

Stay tuned for more insights on February 3."
6mo,"In today's fast-paced digital world, education systems are evolving. While K-12 education has made progress, certain areas still require transformation.

To prepare students for future opportunities, education must embrace bold innovation.

This means focusing on six critical elements:
1. Personalized
2. Experiential
3. Adaptable
4. Scalable
5. Inclusive
6. Sustainable

BCG's latest insights explore how governments, companies, and schools can collaborate to drive the change our education systems need.

Discover how innovation can reshape the future of education:"
6mo,"We asked our BCG delegation what they are looking forward to in 2025.

Here is what they shared."
6mo,"For 163 years, Mammut Sports Group AG has pushed boundaries in performance gear and apparel. From pioneering dynamic climbing ropes to launching decarbonized collections, they’re continuing to reach new heights.

, CEO of Mammut, andjoined Deirdre Bolton in the BCG studio in Davos. Watch the full version of the video on YouTube. Other topics covered include AI's role in product and process innovation and the importance of building a culture of trust."
6mo,"With digitization accelerating in all areas and geopolitical tensions rising, cybersecurity is more critical than ever: 66% of executive respondents in our latest survey said data privacy and security was a top risk, yet 76% also recognize that their AI cybersecurity measures need further improvements.

’sand'sdiscuss what’s needed to foster tech innovation and the developments that they are excited to see in 2025, including IBM’s new product Concert.

Read our latest report on the AI impact gap here."
6mo,"Making time to learn about new ideas and understand different perspectives is a vital part of an organization’s culture and growth.

At BCG, one of the ways of doing that is through two-way mentorship.

In this video, BCG’s Global People Chair,, reflects on what she has learnt by participating in the scheme:"
6mo,"At 
hashtag
#WEF25 in Davos, Sharon Marcil, BCG’s North America Chair, shared her perspectives with Business Insider on the consulting industry and the macroeconomic trends shaping 2025:

⚫ Optimism in Consulting: Sharon highlighted the strong growth potential for consulting this year, driven by AI adoption, pro-growth sentiment, and robust U.S. economic indicators.

⚫ A “Sweet Spot” in Staffing: With an expected increase in demand, Sharon underscored the challenge of finding the ""sweet spot"" between being overstaffed and understaffed. She noted that while off-cycle hiring can help, predicting staffing needs during a surge in activity is never easy. She emphasized the importance of thoughtful resource planning to avoid overextending teams or leaving talent gaps.

Check out the full recap in the latest Davos Diary:"
6mo,"AI agents are a key topic on the ground at 
hashtag
#Davos this week, and they’re already transforming manufacturing and supply chains. 

BCG’s latest report with theexplores two types of AI agents:

⚙️ Virtual AI agents that enable software applications to achieve defined goals autonomously in the digital environment.

⚙️ Embodied AI agents equip physical systems, such as robots, with the ability to perceive and act within the physical environment, allowing for dynamic and complex movements.

What will operations look like in 2030? Learn more:"
6mo,"“In this world, geopolitical resilience is not an optionality, it's a must,” says Nikolaus S. Lang, speaking from the World Economic Forum annual meeting in Davos. 

New BCG research forecasts dramatic changes in world trade flows in the coming decade as national alliances, rivalries, and aspirations rewire the global economy.

Although the research projects that total world trade in goods will grow at an average of 2.9% annually for the next decade, the routes goods travel will change markedly: China will pivot away from Western partners, the global south will see growth, and US-China trade is likely to continue to shrink.

Read our full report “Great Powers, Geopolitics, and the Future of Trade” now:"
6mo,"The theme of this year’s World Economic Forum annual meeting, which gets under way today, is “Collaboration for the Intelligent Age”. 

, BCG’s CEO, tells today’s Financial Times: “We’re anticipating a rebalancing of the Davos agenda this year as, ultimately, CEOs want to get stuff done.”

For business leaders, the top priorities, he says, will be productivity, generating returns from AI, and preparing for increased M&A activity.

Follow our insights live from Davos throughout the week. Learn more:"
6mo,"Forecasting future geopolitical events is often likened to predicting the weather: sudden, unpredictable, and increasingly disruptive.

Business leaders with extensive cross-border operations must sharpen their agility and foresight. Their ability to make informed decisions hinges on the strength of their “geopolitical radar” – their capacity to identify and assess risks on the horizon.

Sometimes a “geopolitical sonar” that can track submerged or underlying movements is also needed.

In collaboration with theand, here's how leaders can navigate a new geopolitical era:"
6mo,"Will 2025 be the year of AI agents?

67% of executives are considering autonomous agents as part of their transformation strategies.

AI agents can meet business goals by using tools, analyzing data, and working across multiple systems with minimal human input—delivering up to 3x the productivity and speed of traditional tools.

But they aren’t a silver bullet for impact, nor are they here to replace humans. Their value lies in reimagining work processes, where AI complements and enhances human capabilities.

Learn more from BCG’s AI Radar survey, featuring insights from 1,800 executives across 19 markets and 12 industries:"
6mo,"Powerful forces are reshaping the global business landscape, creating new dynamics that will define CEO success in the months ahead.

As leaders gather for theAnnual Meeting in Davos, our CEO,, identifies 5 key dynamics facing CEOs in 2025.

Read the full article:"
6mo,"In a recent interview on Bloomberg Asia’s “Insights with Haslinda Amin,” Neeraj Aggarwal, BCG's Asia Pacific Chair, shares his perspectives on the key themes shaping 2025.

From Asia’s growing role in global trade to scaling AI for measurable impact, Neeraj discusses actionable strategies for navigating geopolitical uncertainty, fostering resilience, and driving sustainable growth. He also shares his outlook on the World Economic Forum Annual Meeting 2025, emphasizing the need for honest, solution-oriented conversations to tackle the world’s most pressing challenges.

For more information on
, click here:"
