timestamp,post
1h,"Energy demand in the U.S. is expected to grow nearly 10 times faster over the next decade than it did in the last. 

Next-generation geothermal could become a cost-competitive source of clean, reliable power to help meet that surge."
4h,"Freezing up mid-presentation? You’re not alone.

Communication coach Michael Chad Hoeppner breaks down the most common public speaking mistakes and how to avoid them in his book Don’t Say Um.

Learn how to speak with more confidence and less stress."
7h,"""To go from being great at customer service to being excellent is very hard. To get there, Deutsche Telekom wanted to shift from standardized learning to offering lessons tailored to individual agent needs."" – McKinsey Partner Nicolai von Bismarck

Discover how Deutsche Telekom leveraged AI and millions of pieces of data to deliver personalized training and coaching at scale."
22h,"Companies leading in digital and AI are outperforming their peers by as much as 6x in shareholder returns.

Their edge? A workforce fluent in the digital tools and mindsets that drive impact.

Explore how to build that fluency, close skills gaps, and future-proof your teams."
1d,"What do Strategy Champions do differently? Everything.

They outperform stragglers across all 12 building blocks of strategy, especially when it comes to mobilizing teams and committing to bold moves.

See where top performers build their edge:"
1d,"A $1 trillion reshoring boom is transforming U.S. manufacturing, and 63% of that investment is within reach of rural communities. 

But there’s one missing piece: talent.

Join Sarah Tucker-Ray and Duwain Pinder as they explore how rural schools and industry can partner to unlock opportunity, and tap into $34B in potential annual wages.

Save your spot for the live LinkedIn conversation:

For deeper insight, explore the full article:"
1d,"Small towns… massive opportunity. That’s the simple idea behind two new reports on U.S. rural economic mobility, which look at the challenges facing the 46 million Americans who live in rural communities and how to equitably boost the $2.7 trillion of GDP they contribute each year.

Our first report develops a framework for understanding different archetypes of these communities and their needs, presenting several ideas—from partnerships with high-growth industries to investing in anchor institutions, workforce training, and more—that could help unlock rural America's potential:

Building on that work, the second goes deeper by looking at how smarter partnerships between the manufacturing industry and K-12 school systems—such as apprenticeship programs, manufacturing academies, and more—could help rural communities gain $34 billion in additional wages per year:

These are just a start. Ouris committed to developing independent, objective research to support recommendations that can improve economic inequities, and there will be more to come from our rural communities working group soon.

In the meantime, a huge thanks to the authors—,,,,,,,,, and—and all of our colleagues and clients working on this topic."
3d,"Last week, I joined Josh Bersin in a thought-provoking conversation hosted by Degreed on how the role of Learning & Development is evolving.
We explored what an AI-first learning model means for our field. The shift we’re seeing? From traditional course creation to L&D professionals stepping into roles as technologists, analysts, and performance consultants.

AI isn't just about efficiency. It’s our partner in designing hyper-personalized, in-the-flow learning experiences that scale. When we in L&D work directly with tech teams to design these tools, we create solutions that not only streamline learning but actively develop and coach in real time."
1d,"💭 What’s something you wish you knew early in your career?
This one's from Kweilin Ellingrud, senior partner and co-author of ""The Broken Rung.""
Drop yours in the comments. 👇"
1d,"What do wonder, surprise, and hope have in common? According to bestselling poet Maggie Smith, they’re part of the secret sauce of creativity.

In this edition of Author Talks, she shares how anyone can tap into creative energy, with practical tools and a fresh perspective.

Ready to rethink your creative process?"
2d,"Data centers are the backbone of generative AI, powering everything from your favorite chatbots to enterprise-scale innovations.

By 2030, global investment in data centers could hit $6.7 trillion, driven largely by AI workloads.

Discover what's fueling this growth and how the industry is evolving:"
3d,"What tasks in your role could be reimagined, or automated, to help you focus on what matters most?

For brand marketers, over half of day-to-day activities could be augmented by 2035.

Explore how consumer-facing roles are evolving, and how leaders are creating value by rethinking how work gets done."
3d,"They’re often overlooked, but middle managers sit at the heart of every organization, turning vision into action, building strong teams, and shaping culture.

To unlock their full potential, the role needs a reset. Explore how:"
4d,"Robots that can adapt, learn, and act are stepping out of the lab and into real roles.

Embodied AI is making it possible, and the pace is picking up.

How prepared is your business for what’s next?"
4d,"Many companies are racing to adopt AI, but only some are building the trust needed to scale it safely and successfully.

Our recent insights show that investing in responsible AI now leads to stronger business outcomes, from efficiency to reputation.

Explore what sets AI trust leaders apart, and why falling behind isn’t an option."
5d,"We're proud to partner with Homeboy Industries (HBI), a trailblazer in supporting justice-impacted individuals for over 30 years. 

Through our collaboration, HBI expanded their innovative Workforce Hub Model, codifying and scaling their approach to workforce development. We're honored to have supported HBI's journey toward their mission: helping individuals heal from trauma and contribute fully to their families and communities.

Learn more about the impact HBI is making across communities and our partnership here"
6d,"“I sat on the floor.” 
Here’s what it was like for Dorcas to get her offer to join us as a summer intern. 
hashtag
#McKCareers"
6d,"One in four women return to work just two weeks after giving birth.

To make a difference for parents, Moms First teamed up with McKinsey to understand how many parents were leaving state paid leave on the table and why.

Here’s what they found:"
6d,"Being a great CRO isn’t about having one perfect operating model, its about knowing when to switch between them.

The most agile risk leaders stay grounded in their purpose, yet ready to adapt when the landscape shifts.

Get to know the three CRO archetypes and how to lead with resilience."
6d,"Fuel and convenience retailers are navigating shifting customer expectations and a more crowded market. The right mix of analytics, AI, and customer focus can help them stay ahead.

Explore the moves that matter in our latest article:"
1w,"""It's not only about adding years to life but adding life to years."" - Pooja Kumar, McKinsey senior partner and global leader of the McKinsey Health Institute

Ohio is undergoing a demographic shift, with its population aged 60 and older growing at a rate four times that of the rest of the state.

To better support older adults and their families, the Ohio Department of Aging partnered with us to define a new standard of care – enhance nursing home care, fortify home- and community-based services, and advocate for healthier, more fulfilling lives.

Discover how data, compassion, and bold ambition came together to transform aging in Ohio:"
1w,
1w,"What sets top insurers apart in the AI race? It’s not experimentation, it’s deep integration.

Our latest report unpacks how a few leaders are embedding AI across the enterprise, and seeing 6.1x more growth because of it.

Curious what they’re doing differently? Take a look."
1w,"The global landscape is shifting—resilience is the new advantage.

Where to focus? Start with three fundamentals: value at stake, governance, and organizational structure.

Explore the full insights:"
1w,"Too many companies treat data products like IT projects, and miss out on real business value. 

Success takes strong data product owners who think like business leaders and tight collaboration across teams from day one.

Want to unlock more value from your data? It’s time to rethink how you lead data product programs."
1w,"Despite booming interest in fitness, a third of adults, and even more young people, aren’t moving enough. In this episode of The McKinsey Podcast, we unpack the disconnect and what it means for brands navigating today’s polarized fitness landscape.

Tune in for fresh insights on what’s next in sports and wellness:"
1w,"Today’s CEOs are in a unique position to turn disruption into advantage.

By focusing on resilience in the areas that matter most, they can protect their organizations, and help them emerge even stronger. Explore 5 key actions we outlined to help leaders build smarter, more shock-resistant companies."
1w,"When purpose has a platform, impact scales.
For Diana, that meant leveraging tech to open doors—from helping refugee children learn to code to pushing the boundaries of AI in life sciences.
Learn more about how she’s putting tech to work for something bigger ➡️"
1w,"What happens when you challenge long-held assumptions about who belongs on the factory floor?

In our latest Leading Asia interview, Rajesh Rathi shares how bringing more women into frontline roles has improved performance, and helped shape a global growth story.

Watch the full conversation."
1w,"Building with generative AI? One-off solutions won’t cut it at scale.

The most successful organizations are using open, modular architectures that let them plug in best-in-class capabilities and avoid vendor lock-in.

Explore how reusable components and smart design choices are helping leaders accelerate, and future-proof their gen AI strategies."
1w,"The office is being reimagined—designed for connection, powered by AI, and built with sustainability in mind. It’s not just where we work—it’s how we work, better.

So, what does the next-gen workplace look like? Dive into the latest insights in our McKinsey Quarterly feature:"
1w,"Society as a whole benefits from early investment in ecosystems that uplift, inspire and prepare individuals to succeed.  The latest installment of The Executive Table features Shelley Stewart III, Senior Partner, and Global Leader, Reputation & Engagement at. Stewart discusses why encouraging the private, public and social sectors supports positive outcomes for us all.

Watch Shelley’s episode and explore more candid conversations on The Executive Table, Bloomberg Media Studios’ new video series spotlighting the leaders redefining the future of business:"
1w,"Digital skills aren’t just for tech teams anymore.

As AI and new technologies reshape work, companies need everyone—from tech teams to frontline staff—ready to contribute.

Here’s how to get started:"
1w,"📍Welcome to the new McKinsey Paris office—just in time to mark our 60th anniversary in France.

What’s it like to work here? It’s checking all the boxes:
✅ A view of the Eiffel Tower and Hôtel des Invalides from your desk
✅ Croissants and coffee at Le Grand Café (team matcha? You’re covered)
✅ La Brasserie with the best choux à la crème in the arrondissement (don’t @ us 😁)
✅ Rooftop apéros with a 360° view of the city

Ready to make your next move? Explore careers in our Paris office ➡️"
1w,"Could next-gen geothermal be the breakout player in the U.S. clean power mix?

Our latest analysis shows it has the potential to deliver up to 100 GW of energy by 2050, with early momentum building in the western U.S.

With demand for clean, reliable power rising fast, now’s the moment for stakeholders to lean in. Explore the insights:"
2w,"The youth mental health crisis is real, but there’s real opportunity, too.

School-based services can play a powerful role in prevention, early intervention, and lifelong well-being.

See six key actions can make a big impact—discover them here:"
2w,"Will robots really join your team?

Embodied AI is bringing general-purpose robots closer to the workplace, but there’s still a big gap between the hype and what’s actually possible.

Explore what these bots can (and can’t) do, plus what it means for your business."
2w,"What are leaders reading in 2025?

McKinsey’s annual reading list is here, featuring 90+ books spanning AI, leadership, memoir, and more. Browse recommendations from global leaders, save your favorites, and explore themes shaping our future.

Dive in:"
2w,"Only 1 in 5 companies say they have a high-quality strategy. So what sets them apart? Bold thinking and the ability to turn strategy into action.

We studied 400+ companies and found that top performers stand out not just for their ideas, but for how they execute them.

See what Strategy Champions do differently:"
2w,"Thirteen frontier technologies have the potential to transform global business. From agentic AI to sustainable energy, leaders must navigate complexity and build trust as they experiment with new innovations.

What tech trends will shape your future? Find out in our new Technology Trends 2025 Outlook⬇️"
2w,"The skies are busy again, but where is the aviation industry really headed?

New economic realities, shifting customer expectations, and global uncertainty are all changing how airlines fly forward.

Explore what’s shaping the next chapter of aviation."
2w,"How does a childhood fascination with video games turn into a career building tech that solves real human problems?

Sallah Kokaina shares how he's using AI, hackathons, and heart to drive change at the firm.

Curious? Dive into his story and get inspired."
2w,"The gen AI pilot era is ending.

To scale real value with AI agents, CEOs must rethink how their orgs operate starting now. See the 3 actions leaders can take to unlock enterprise-wide impact:"
2w,"The biggest obstacle to women’s career growth isn’t the glass ceiling—it’s the broken rung. 

But there’s a way up: building experience capital.

Learn how to close the advancement gap:"
2w,"Frontline innovation is redefining how work gets done.

Aramco, Unilever, and Western Digital are boosting safety, productivity & career growth with tech-driven training and smarter job design.

Explore how the future of frontline work is already taking shape."
2w,"What might happen to global trade patterns when things are in flux?

Amid pressure on US–China trade, companies may look to rearrange sourcing to alternative suppliers. If they cannot, companies might instead reduce purchases, replace imported products with something similar, or ramp up domestic production.

These alternatives require a combination of sacrifice, resources, know-how, and time.research quantifies how hard the change might be.

Explore more:"
2w,"🌍 Sydney’s a self-described manufacturing and supply-chain “nerd” who turned her passion into purpose as a Fellow with the World Economic Forum’s Global Lighthouse Network.

She’s spent the past year on the ground assessing which factories are truly transforming—through tech, sustainability, and frontline talent.

Now, she’s bringing that experience back to her teams and clients.

📲 For more stories like Sydney’s, follow us on Instagram:"
2w,"Gen AI is gaining ground in banking, but the pace varies.

While 52 percent of institutions are making bold moves in credit, others are cautiously exploring or still on the sidelines.

What separates the leaders? See what the data says, and where the opportunities are."
3w,"Decarbonization just got smarter.

Dynamic MACCs help leaders prioritize the most cost-effective levers for reducing emissions by region, sector, and impact.

Explore how to make your climate strategy more actionable and achievable."
3w,"Redesigning your operating model doesn’t have to feel like a leap in the dark. Our research uncovered 9 essential rules that boost the odds of success—from just 29 percent to an impressive 97 percent.

These practices help organizations realign structure, processes, people, and culture to support new ways of working and thrive in a world that’s constantly shifting.

Discover the new rules of redesign and how they can work for you."
3w,"Claims are the moments that define trust between insurer and customer. Getting them right matters.

set out to make those moments easier by rethinking complex claims processes with the help of AI.

Partnering with the firm and, they built and embedded smart tools across the claims journey, strategically and at scale.

The impact? Happier customers. Empowered teams. And one of the UK’s leading claims operations.

Learn how they made it happen:"
3w,"“The future is already here—it’s just not evenly distributed.” With apologies to William Gibson, I’d add: “And it’s constantly being redistributed, too” … toward the organizations that learn the fastest. 

That’s my big takeaway from a new article my friendand I published last week, “The learning organization: How to accelerate AI adoption.” In it, we share a few ideas on how we’ve seen companies successfully embrace, accelerate, and scale these new technologies across their business. A few broad strategies to consider:

-Nurture what’s already growing: A “gardener’s mindset” will be more successful here than forcing it top-down

-Create incentives for adoption: Financial awards are great—adding social recognition and competition is even better

-Foster rapid learning: Apply A/B testing principles—start with a clear hypothesis, design for learning, embrace small samples, and document the “why""

-Maintain high standards for praise: There’s enough hype around AI already—separate the interesting (worth trying) from the game-changing (worth scaling)

These are just a start—you can find more thoughts and examples in the full article here:

Big thanks to Yuval for collaborating on this, and to all of our colleagues who are helping clients rewire their businesses every day."
3w,"We're advancing economic opportunity across every part of the Firm — from our clients and insights to our actions and giving.

One part of our ongoing journey to foster sustainable and inclusive growth is our Action 9 initiative. By committing $200 million by 2030 in pro bono work that helps advance opportunity among Black communities globally, we provide support and partnership to organizations that create pathways to success and break down the barriers that have prevented people from achieving their full potential.

We believe when organizations thrive, economies prosper, and people progress. Learn more about Action 9 here:"
3w,"The breakthroughs get the spotlight. But in AI, real impact often comes from what happens between the big moments—how teams fail, rebuild, and rethink together. 
👉 Swipe through Sohrab Rahimi’s 3 lessons on building AI with impact. 
hashtag"
3w,"Robots that learn on the fly, take voice commands, and adapt to human environments? They’re not just prototypes anymore.

Embodied AI is unlocking general-purpose machines that could soon be your coworkers.

See what’s real, what’s next, and why now’s the time to pay attention."
3w,"Think video games don’t belong in consulting? Think again.

Our game-based innovation lab is building immersive tools for learning, hiring, and professional growth with real science behind the screens.

Step into the lab where playful ideas turn into serious innovation."
3w,"The age of solo leadership is fading. Today’s challenges call for senior teams that lead as one.

A bold approach to leadership transformation, grounded in 5 key elements, can help organizations meet the moment.

Here’s how to begin the journey and deliver impact at scale:"
3w,"What does it take to lead a 150-year-old insurance company through transformation?

In the latest Inside the Strategy Room episode, Vince Tizzio, CEO of AXIS Capital, shares how he's helping the company pivot in a rapidly shifting risk landscape

We talk strategy activation, leadership mindset, and how to drive growth with clarity.

🎧Listen now:"
3w,"From childhood curiosity to continent-wide impact.

Sallah Kokaina’s journey from a love of video games to leading AI transformation across industries is all about making innovation human, and results tangible. His story is a reminder that the real magic of tech is in solving real problems. Here’s how he’s engineering change with purpose:"
3w,"Platforms power the future of business. 

Digital marketplaces are doing more than reaching global audiences; they’re sparking new growth, new insights, and entirely new ways to operate. Explore this and seven other breakthrough ideas in this interactive from McKinsey Quarterly’s 60th birthday edition on growth:."
3w,"We are honored to be recognized by TIME and Statista as one of the 'World's Most Sustainable Companies' of 2025. 🌍

At McKinsey, we're dedicated to our commitment to building a greener and more sustainable future. Read more about our sustainability work here:"
3w,"Once a Turkish Education Foundation (TEV) scholar, now a changemaker: Yade helped reimagine the very system that shaped her.

With our support, TEV launched Obigenç—a mobile platform transforming student access to scholarships and support.

See what’s next:"
4w,"As the excitement of Cannes Lions International Festival of Creativity settles, we’ve been reflecting on the key themes from this year’s event. 

Want to know what’s set to have a lasting impact on marketing, media, and growth in the years ahead?

Look no further. 👇"
3w,"The $1.8T wellness economy isn’t driven by one kind of consumer. It’s shaped by five.

From tech-focused optimizers to routine-loving traditionalists, each segment has unique needs. Curious where your brand fits in? Get to know them better."
4w,"What’s top of mind for today’s leaders? Our newly redesigned McKinsey Featured Insights page compiles each week’s top thinking and interactives on crucial business topics.

Explore this one-stop shop for our series, including Author Talks, The McKinsey Crossword, Explainers, Themes, and more:"
4w,"CEOs say marketing is key. CMOs agree. So why is funding falling?

Budgets are shrinking, goals aren’t fully aligned, and there’s a clear gap between intention and investment. Getting the CEO, CFO, and CMO on the same page is no longer optional—it’s essential for growth.

Explore the recent conversation with the firm's Kelsey Robinson andon how leadership teams can close the gap and unlock impact."
4w,"Looking for your next great read? 

We asked our colleagues to share what's on their bookshelves, and they delivered. From memoirs and classics to thrillers and everything in between, browse the list here:"
1mo,"Multimodal AI is unlocking new possibilities—from intuitive customer interactions and smarter automation to more human-like intelligence and richer outputs.

Learn how multimodal generative AI models work ➡️"
1mo,"Work ruts happen. But they don’t have to last. 

Get unstuck with a weekly dose of actionable insights on everything from decision-making and burnout to creativity and confidence.

It’s practical, easy to digest, and lands in your inbox just once a week. Start your reset here:"
1mo,"What makes an effective CEO? In short, comfort with embracing polarities.

Our work with women CEOs reveals that they excel as leaders when they ground their vision in purpose, balance relationships and outcomes, hone their strategic priorities while executing in the day-to-day, show up as confident yet humble, and create an integrated life.

It’s not just a leadership style; it’s a mindset shift. Discover how to develop the human-centric leadership skills needed for success:"
1mo,"AI agents aren’t just tools, they’re becoming digital coworkers.

To stay ahead, organizations need to move beyond task automation and start designing for smarter decision-making. Discover how to strike the right balance between AI and human judgment—and why it could be your next competitive edge:"
1mo,"He argued with umpires, kicked bases, and quietly pioneered analytics before it was cool. 

Earl Weaver helped reshape baseball, and left behind timeless lessons in leadership, talent, and grit⚾.

Curious how a manager from the '70s still has something to teach CEOs today? Catch the full Author Talks conversation."
1mo,
1mo,"The job market is shifting fast—AI is changing how we work, but the data isn’t telling the full story.

On the latest McKinsey Talks Talent,ofjoinsandto unpack what leaders need to know about AI, workforce trends, and what’s next.

Listen in:"
1mo,"The years since 2020 have been a time of upheaval for consumers and companies alike, and packaging players are no exception. 

The global pandemic shifted consumption patterns; many countries went through a period of high inflation, and geopolitical uncertainty continues to reshape trade flows.

How have these factors affected the choices consumers make and especially their attitudes and sentiments toward packaging?

Our 2025 global packaging survey explores consumer preferences, with three questions for packaging players emerging. Read the full article:"
