timestamp,post
1mo,"As we wrap up our time at the Aspen Ideas Festival, one message stands out: learning isn’t a moment, it’s a mindset.

From conversations on inclusive growth, health, and innovation to reflections on leadership and purpose, this week was a powerful reminder that curiosity and a commitment to lifelong learning are essential to shaping what’s next."
1mo,"What does it really take to create long-term value in a rapidly shifting business landscape?

In our latest Inside the Strategy Room episode, two of the world’s leading thinkers on corporate valuation — Tim Koller and Marc Goedhart — reflect on the evolution of value creation through eight editions of their seminal book, Valuation.

Tune in to hear insights shaped by 40+ years of advising boards, CFOs, and strategy leaders around the globe.

Listen now:"
1mo,"Through our Action 9 initiative, in 2020, we committed $200 million in pro bono work globally to help advance opportunity and economic empowerment among Black communities globally.

Over the last five years, Action 9 has invested $86 million, worked with over 45 partner organizations, and engaged more than 500 colleagues across 60 global offices.

To learn more, visit:"
1mo,"What happens when AI doesn’t just assist, but actively decides?

Forward-thinking companies are reimagining operations by teaming humans and AI agents in new, dynamic ways. The results include faster decisions, better outcomes, and a future-ready model.

Explore how smart ops are reshaping service delivery. ➡️"
1mo,"McKinsey.org shares the best of McKinsey – at no cost – to help more people succeed. 

See below how our partnership with JA Europe is helping empower the region’s next generation of entrepreneurs"
1mo,"How can leaders cultivate work environments that strengthen connection, innovation, and performance—no matter where people work? At the Fortune Workplace Innovation Summit last month, McKinsey’s Brooke Weddle explored the nuances of the return-to-office debate.

Drawing on our recent research on various working models, she discussed what truly matters for enhancing employee engagement, retention, and impact in the modern workplace.

Watch a recording of the session:"
1mo,"As technology races ahead, one thing remains clear across industries: the importance of holding on to the unique spark that makes us human. ✨

“How do we utilize the benefits of technology—the speed, the innovation, the productivity—without losing our humanity?” -McKinsey Partner,"
1mo,"Progress happens when people come together. 🏳️‍🌈

Equal, McKinsey’s LGBTQ+ employee resource group, began 30 years ago with just a few voices. Today, it’s a global community of more than 1,800 members committed to inclusion and impact.

From driving change within the firm to supporting LGBTQ+ nonprofits through pro bono partnerships, Equal continues to shape a more inclusive future.

As we celebrate this milestone, we’re honoring the people and partnerships who made it possible."
1mo,"Not all trade routes will weather the next decade equally.

By 2035, one-third of global trade could be exposed to volatility, and some corridors risk losing 76% of value.

Here’s how to plan ahead."
1mo,"AI is booming, but are we ready for the power and investment it needs?

From real estate to energy to data center speed, businesses have big decisions to make, fast.

Tap into what leaders need to know now."
1mo,"Not everyone takes the same path to get here. That’s what gives us our edge. 🎯 
Ready for what’s next? ➡️ https://mck.co/4nofz3m
hashtag
#McKCareers"
1mo,"We’re living longer. 🌱

Did you know that by 2050, 1.6 billion people will be over the age of 65?

Co-Director of Healthy Longevity at the,shares her perspective on why healthy longevity should be top of mind for leaders across all sectors."
1mo,"The conversations here at the Aspen Ideas Festival have covered everything from AI to organizational health.

One key theme: how organizations can better support employees.Co-Director of Healthy Workforces at the, shares why employee health and well-being should be a top priority."
1mo,"Think quantum computing is still years away? Think again. 

With breakthroughs like Microsoft’s new chip and surging investment, we’re entering the era of exponential computing power. Discover what leaders should know, and why it’s time to act:"
1mo,"Not all innovation efforts are created equal, and most companies are struggling in the same four areas.

Our latest research pinpoints the biggest hurdles to delivering growth, based on the 8 essentials of innovation. The good news? Once you know the weak spots, you can start to fix them.

Take a look at what’s holding teams back and how to move forward."
1mo,"Is your operating model built to thrive, not just survive?

In a world shaped by disruption, the most successful organizations aren’t just reacting, they’re redesigning how they work. A future-ready operating model translates strategy into action and helps unlock real, measurable value.

So what does it take? Clarity. Speed. The right skills. And a shared commitment to deliver.

Our latest article breaks down a data-backed approach to reimagine your operating model for impact.

Read more:"
1mo,"Five years later, pandemic-era habits are still shaping what consumers want.

Brands that adapt fast to this “new normal” will be the ones that win big.

Here’s how to stay ahead of the curve."
1mo,"India has a rare opening to lead in a reordering world.

Global Managing Partner Bob Sternfels says India can be a global connector linking regions, attracting capital, and accelerating faster toward growth. Read the full conversation:"
1mo,"AI, ESG, and digital transformation are rewriting the rules, but value creation fundamentals still hold. The 8th edition of Valuation blends timeless principles with today’s most pressing realities.

See how decision-makers can navigate complexity with confidence in our recent Author Talks interview with McKinsey partner Tim Koller:"
1mo,"Building with generative AI? One-off solutions won’t cut it at scale.

The most successful organizations are using open, modular architectures that let them plug in best-in-class capabilities and avoid vendor lock-in.

Explore how reusable components and smart design choices are helping leaders accelerate, and future-proof their gen AI strategies."
1mo,"Innovation isn’t always about big swings. Sometimes, it’s about getting out of your own way to solve crucial problems. Curious how the best leaders and their teams spark creativity, build confidence, sharpen decision-making, and avoid burnout? 

Sign up for our 7-week email guide to break through career plateaus and build lasting momentum →"
1mo,"The future of work is already arriving, powered by AI agents.

In this episode of McKinsey Talks Talent, Jorge Amar explores what it means to collaborate with AI, how companies are experimenting today, and where this could lead next.

Listen to the conversation, starting with a quick snippet below."
1mo,"Under Mukesh Ambani’s leadership, Reliance Industries Limited has grown from a domestic textiles business into one of Asia’s largest and most diversified companies – with major positions in energy, telecom, retail, and advanced tech.

In the latest on Leading Asia, McKinsey’s interview series featuring in-depth conversations with the region’s most value-creating CEOs, Ambani spoke with our Asia Chairman Gautam Kumra about the leadership principles and strategic choices behind Reliance’s success.

Read the full conversation:"
1mo,"Progress is happening, but parity is still a work in progress.

Women hold more C-suite roles today than a decade ago, yet the gap remains wide.

What will it take to close it? Explore the latest insights on gender representation in leadership."
1mo,"Leadership development isn’t one-size-fits-all. Our insights from Connected Leaders Academy (CLA) show how peer learning, identity exploration, and thoughtful sponsorship can transform emerging talent into impactful leaders. 

After five years of CLA, we're sharing what’s working and how to apply it:"
1mo,"Everyone sees the app. Few see the architecture.

Starbucks CTO Deb Hall Lefevre shares how treating architecture as strategy unlocks speed, scale, and innovation across the business.

It’s time for tech leaders to think beyond features, and lead with purpose. Take a closer look:"
2mo,
1mo,"Merck, in collaboration with McKinsey & Company and QuantumBlack, AI by McKinsey, has launched a generative AI platform that’s transforming clinical study report (CSR) development. By integrating large language models and advanced data engineering, the platform has reduced the time it takes to complete CSRs from two-to-three weeks to three days, while improving accuracy.

This marks a breakthrough in applying gen AI at regulatory quality! Read more about the work here:

Many thanks to our colleagues,,,, andfor their leadership here!"
1mo,"With up to one-third of global trade flows facing potential disruption by 2035, companies need sharper, sector-specific strategies to stay resilient.

See how leading organizations are planning smarter to overcome uncertainties."
1mo,"India’s growth story is entering a bold new chapter.

18 high-growth sectors could more than double in size by 2030, fueled by tech innovation, investment, and expanding markets. Explore where the biggest shifts and opportunities are unfolding:"
1mo,"What’s the real impact of tariffs on your supply chain strategy? It might be bigger than you think.

In a shifting trade landscape, global companies are finding both risks and opportunities. Our latest podcast dives into how they’re adapting, and what it takes to thrive.

Listen in for smart, actionable insights:"
1mo,"In uncertain times, it’s tempting to hit pause on innovation. But the most resilient companies lean in smartly.

Our latest research shows how top performers are maximizing returns without increasing spend. From portfolio teardowns to smarter funding bets, see how to keep innovating when it matters most:"
1mo,"Tariffs are changing how global consumers spend, but one splurge category rose to the top across regions. 

When you’re looking to splurge these days, what are you most likely to spend on?

Discover how consumer trends are shifting:"
1mo,"Banking’s future is here.

At our Global Digital Banking Conference, 300+ leaders came together to explore how top banks are scaling generative AI, navigating cloud talent gaps, and building trust in a rapidly shifting landscape.

See what stood out and where the industry’s headed next:"
1mo,"Meet the next frontier of AI: systems that don’t just process, they think, adapt, and act.

Agentic AI is already reshaping industries from finance to customer service. But without thoughtful oversight, the risks rise as fast as the opportunities.

Read how businesses are getting ahead by treating AI like a new kind of corporate citizen."
1mo,"More than half of employees say they’re not all that satisfied at work.

Our research shows that boosting employee satisfaction is a smart strategy for long-term performance. Want to know where your team stands? This quick quiz helps you map where people fall on the satisfaction spectrum, and how to move them up it.

Take the quiz →"
1mo,"Think your org chart is set? Imagine it with AI agents working alongside your team.

From recruiting to coaching to customer service, agentic AI is already here and it’s transforming the way work gets done.

Curious how it all works and what it means for your org? Tune in:"
1mo,"Effective leaders continually adapt their priorities, roles, time, and energy practices to stay ahead of new realities. 

Explore the 4 drivers of the personal operating model, critical questions associated with each, and best practices for building and maintaining such models at both the individual and organizational levels:"
1mo,"How do we move from a “sick care” industry to a true “health care” industry?

Drew Ungerman, global leader of McKinsey’s social, healthcare, and public sector entities work and global coleader of the, recently joined the McKinsey on Healthcare podcast to discuss the transformative potential of patient-centric care, effective leadership, and cutting-edge technology.

Listen here:"
1mo,"Remote work isn’t going anywhere, but it’s not one-size-fits-all. 

Age, income, gender, and education all shape who gets to work from home and who actually wants to. For companies and real estate leaders, that’s an opportunity to reimagine space, flexibility, and the future of work.

See what the latest data reveals."
1mo,"What makes today’s top women CEOs so effective?

Women CEOs are showing how confidence, clarity, and purpose can shape not just companies, but culture.

Explore the leadership traits that matter most."
1mo,"Hard truth: Where you start in life still matters more than it should. Let’s change that.
Join our next McKinsey Unpacked for a candid discussion on access, opportunity, and finding your way in today’s job market.

📅 Register by June 29 ➡️"
1mo,"Gen AI can move fast, but without the right platform companies risk major setbacks.

Want to scale smarter and faster? Here’s how:"
1mo,"Commerce media is reshaping how, and where brands connect with customers.

New players, new platforms, and rising expectations are changing the rules of engagement for advertisers and CMNs alike.

Explore what’s next, and how to lead in this evolving landscape:"
1mo,"AI has been a major topic at this year’s Cannes Lions International Festival of Creativity. So, where will this wave of AI innovation take marketers next?

McKinsey Senior Partnershares her perspective on what to watch for in the second half of this year. It’s not just about AI pilots, it’s about end-to-end reinvention."
1mo,"Change happens when The Female Quotient comes together. ❤️ 
 
Lareina Yee and Shelley Zalis brought together an intimate group of leaders to discuss the impact of transformative action atyesterday.

One topic was ""paying it forward"": how one act of kindness not only opened doors for one woman, but also created a ripple effect – inspiring others to do the same.

Empowering women leaders is a topic close to Lareina’s heart; she recently published ‘The Broken Rung’ to provide women with strategies to overcome a phenomenon that holds many back from career success.

For more on
➥"
1mo,What happens when opportunity meets access? Senior partner Lucy Pérez shares insights from our research on supporting Latino entrepreneurs and what inspires her passion for the work. Check it out below 👇
1mo,"Some companies aren’t just dipping their toes into AI, they’re diving in headfirst. 

We’re talking full company shutdowns for 1–2 weeks just to upskill teams and make AI second nature. As Partner Eli Stein says: bold change takes bold action.

Could this be your company’s moment?"
1mo,"Operating globally used to be straightforward. Not anymore.

As the world fragments, leaders of multinational companies face a new reality, and ten key geopolitical forces that could define their next move.

See how smart strategy and agile design can turn disruption into opportunity."
1mo,"What sets resilient leaders apart?

They don’t just weather disruption, they use it to leap ahead. This edition of McKinsey on Risk & Resilience dives into the bold moves organizations are making to thrive in uncertainty.

A must-read for anyone navigating today’s fast-moving risk landscape."
1mo,"Marketing’s been riding in the backseat for too long and companies are feeling the loss of customer connection. 

What happens when the CMO, CFO, and CEO finally align? Big growth. Real results. And a company that listens to its customers again.

See how strategic collaboration is transforming the C-suite."
1mo,"Are you being bold enough in your career?

The McKinsey Global Institute has set benchmarks for the buzzword, defining what 'bold' really means and how talent across experience levels can use AI to make significant strides for themselves and their organizations."
1mo,"Where’s new B2C growth hiding?

Three models—advice-as-a-service, embedded services, and B2B2C—are driving big wins across sectors. Think personalized advice, built-in services, and new direct-to-consumer channels.

See the full breakdown:"
1mo,"What are the most important trends impacting alignment between CMOs and CEOs? 

Join me andRobinson for an important discussion on these topics and more in an upcoming McKinsey Live session, where we’ll explore top insights from industry leaders and the future of marketing and business leadership at
.

Register here:"
1mo,"Customers now live in a world where they expect their favorite brands to meet them wherever, whenever, and however they choose to engage.

To succeed in this landscape, marketers must strike a strategic balance, blending data-driven decision-making with bold, human storytelling. Modern marketers shouldn't be seen as just campaign executors; they’re business leaders driving customer-centric strategies that fuel growth. ➡️"
1mo,"Employees are ready to embrace AI, but are leaders doing enough to help them thrive? 

According to recent research, 3x more employees are using gen AI for a substantial portion of their work than their leaders realize.

The right strategy can unlock new levels of creativity and productivity. Here’s how to make AI work for your workforce:"
1mo,"What difference does a strong CEO-CMO relationship make in 2025? 
 
Robert Tas, Kelsey Robinson and Jeff Jacobs are on the ground at Cannes Lions International Festival of Creativity, sharing the top takeaways from our new research – HOT OFF THE PRESS today!

If you’re looking for inspiration, check-out:

- The CMO Comeback (in association with):

- Our full
agenda:

And here’s the marketing and advertising press’s take on our new CEO-CMO findings:

: ➡️
: ➡️"
1mo,"The secret to transformation? It's not a strategy. It's your team.

Too often underrecognized, high-performing teams fuel innovation, grit, and real results. Our research shows 4 ways leaders can help teams thrive, starting now.

See what's possible:"
1mo,"Exciting news coming out of Viva Technology. Our team on the ground presented our latest whitepaper on seizing the agentic AI advantage.

The paper explores AI agents as the latest frontier in gen AI and their potential to automate business. But unlocking their full potential requires a shift.
Read more. 👉"
1mo,"The semiconductor industry is now one of the most valuable sectors in the world, and it’s also one of the most exposed to global disruption.

As tariffs continue to shift, some companies are staying ahead by building “nerve centers” to respond in real time and plan for what’s next.

Explore how this high-stakes sector is navigating a dynamic new era."
1mo,"Sustainability isn’t a side project—it’s central to how we work and grow. We go where the challenges are toughest, turn climate ambition into measurable results, and apply what we advise to our own operations. 

🎥 Hear from colleagues who accelerate this work every day and learn more about our progress:"
1mo,"Commerce media networks are the next frontier in digital advertising, reaching beyond retail into finance, travel, and more. 

With 21% CAGR and a projected $100B market by 2027, the time to tune in is now.

Explore what’s fueling the shift."
1mo,"We seek to build trust with clients, colleagues, and communities by creating a culture where doing the right thing isn’t a choice—it’s the standard. Discover more: https://mck.co/3ZZEcJC."
1mo,"Viva Technology doesn’t slow down—and neither do the ideas.

Earlier, David Champagne took to the stage to discuss the potential of Scientific AI. Could AI reverse the productivity paradox in Life Sciences?

Dive into our conversation with David to uncover the answers!"
1mo,"Legacy tech slowing you down? You're not alone.

Composable architectures help you ditch the tech debt and move fast, without breaking everything underneath.

Explore how CEOs are rethinking their stacks for speed, scale, and resilience:"
1mo,"Digital factories? Deploying Al agents at scale? This is no longer science fiction.

We caught up with Stéphane Bout at Viva Technology, to hear how the potential of agentic Al goes far beyond productivity gains...

Learn how we are helping organizations deploy agents at scale:

Join us tomorrow atto hear more from our colleagues! Here's the full agenda:"
1mo,"Day one at VivaTech is buzzing! 

Fresh from stage, we caught up with Alexander Sukharevsky, who led a plenary session on agentic Al.

Alex told us how the transformative power of using agents at scale could reverse Edison's adage 'genius is 1% inspiration and 99% perspiration' 💡

See how together with, we are helping organizations deploy agents at scale:

See tomorrow's agenda here:"
1mo,"We’ve been measuring attention all wrong. It’s not just about how long people watch, but how focused they are when they do.

Our new research reveals a smarter way to value attention: one that considers focus, intent, and the job to be done. Spoiler: quality trumps quantity.

Whether you're a brand, creator, or platform, it’s time to rethink your content strategy."
1mo,"What if powerful tools for growth were free and available to everyone?

Through McKinsey.org, we’ve supported thousands of learners and nonprofits worldwide with programs that build confidence, strengthen teams, and unlock potential.

Explore below to learn how we're making a difference."
1mo,"While uncertainty looms, European consumers are holding their ground.

Our latest report shows sentiment ticking up in Q2, even as US consumers grow more wary. Inflation’s still on the radar, but its grip is loosening. Spending on essentials is steady, and experiences like travel and dining? Still going strong.

This cautious confidence sets Europe apart. Dive into the data →"
1mo,"Asia’s markets are diverse, and so are the demands of leading across them.

In a new Leading Asia article, our interview series on what it takes to lead in today’s Asia, Toll Group Managing Director Alan Beacham speaks with McKinsey senior partner Mukund Sridhar about his approach to leadership, ambition, and decision making across the region.

Read or watch their full conversation:"
1mo,"The energy transition is moving, but can the infrastructure keep up?

Our latest report breaks down 10 physical realities that could make or break the shift to low-emissions tech. Explore the full story here."
1mo,"What do orthodontics, music, and AI agents have in common?

McKinsey partner Sohrab Rahimi shares his experiences in becoming an AI expert, and reflects on the team dynamics crucial to solving tough problems.

Explore howis helping reshape the future of work:"
1mo,"Yade once applied for a scholarship through the Turkish Education Foundation (TEV). Years later, as a business analyst at McKinsey, she helped reimagine the entire system. 

In partnership with TEV, we helped launch a powerful new platform, Obigenç, to reach more students faster and with greater impact. It’s a story of full-circle purpose, smart tech, and bold ambition.

Explore what’s possible when mission meets transformation:"
1mo,"Healthy organizations with a strong foundation of alignment consistently deliver value and sustain long-term success. In other words, alignment is key to thriving, not just surviving, in today’s fast-paced world. 

Achieving organizational alignment requires clear direction, a sustainable work environment, and adaptable leadership.

Without these 3 outcomes, even the best strategies can falter. Learn more below and in our blog post here:"
2mo,"Who makes better slides—a McKinsey consultant or gen AI agent? 

As Kate Smaje pointed out in Bloomberg this week, it’s not a competition—it’s a collaboration:

Just take Lilli—the internal gen AI platform we built using's collective knowledge base. Yes, there are Lilli agents that can make slides and charts. But more than that, there are others capable of deep research, data synthesis, and other high-level tasks—real hallmarks of our profession.

Even so, we don’t see tech as replacing consultants… far from it. We see it augmenting us.

What does that look like? More creativity. More ability to drive real change. And more time helping our clients across virtually every industry better use gen AI to improve their business. That’s how we will continue to raise the bar on what’s possible. That’s why we’re all here.

McKinsey consultant or gen AI agent? It’s not an either/or… it’s a very exciting “and.”"
2mo,"Our latest survey of 1,300 nurses across the United States dives deep into the state of the nursing workforce.

We explore how healthcare organizations can empower and support their nurse managers while also improving the workplace for frontline nurses, advancing patient care, and potentially saving up to $700 million per year in this new report:"
2mo,"The aviation industry is enjoying a welcome boost from resurgent postpandemic air travel demand. But economic trends, geopolitical events, and consumer expectations could reshape the business trajectory once again. 

Here's how stakeholders can prepare:"
2mo,"Burnt out but hyper-aware, Gen Z and millennials are rewriting the rules of wellness and where they spend.

Spoiler: it’s not just about green juice and gym gear anymore.

Explore how they’re shaping a $500B+ industry →"
